"176";"0";"0";"31";"5460312";;"1714";"1";"3";"3";"1";"1";"1";"0";"1";"0";"0";"0";"0";"1";"Themenfokus";"0";"0";"0";"1";;;;;;;;;;;;;;;;;;;;;;;;;;;;;;;;;;;;;;;;;;;;;;;;;;;;;;;;;;;;;;;;;;;;;;;;;;;;;;;;;;;;;;;;;;;;;;;;;;;;;;;;;;;;;;;;;;;;;;;;;;;;;;;;;;;;;;;;;;;;;;;;;;;;;;;;;;;;;;;;;;;;"Einzelbüro; mind. zwei Rechner; je Rechner zwei Bildschirme; kollegiales Arbeitsumfeld; gut Bezahlung; anregende Aufgabenstellungen; keine ständige Belästigung mit Ad hoc Anfragen; keine ständige Aushilfe bei Kollegen, die deren Aufgaben nicht bewältigen können;";"1";"1";"1";"1";"1";"1";"1";"3";"3";"0";"0";"0";"0";"0";"0";"0";"1";"0";"0";"0";"0";;"Einzelhandel (Drogerie; Reformprodukte; Fotografie; chemische Haushaltsprodukte); Versicherungen; Finanzen; Aussendienst; Vertriebsinnendienst; Produktentwicklung; Projektleitung in Finanzfragen; operatives Controlling; Finanzcontrolling; Reporting; Konzeptentwicklung zu Finanz- und Vertriebsfragen;";"1";"Drogist; Versicherungfachwirt; (Betriebswirt) Controller;";"0";;"0";;"Finanzcontrolling; Finanzreporting; ";"7";"keine Überstunden mehr";"0";;"0";;"1";"ich muß mich jede Stunde für einige Minuten bewegen können";"1";"ich brauche eine anregende Umgebung";"0";;"0";;"1";"ich rede gerne mit Leuten die geistig rege bzw. auf einem ähnlichen geistigen Niveau sind";"0";;"1";"ich mag es nicht mehr in einer Umgebung zu areiten in der Leute aus Prinzip nieder gemacht werden, daher kein Einzelhandel mehr";"1";"ich würde gerne mein jetziges soziales Umfeld behalten";"0";;"1";"ich möchte noch genug Reserven für das Privatleben haben";"0";;"Ich gewinne sehr schnell den Überblick und sehe sehr schnell die Verknüpfungen in einer Problemstellung oder einer Entwicklung. Daher kann ich Probleme sehr schnell lösen. Diese Fähigkeit erlaubt es mir auch mich in sehr hoher Geschwindigkeit irgendwo einzuarbeiten. Aber, auch ich brauche Zeit um mich einzuarbeiten. Ich kann trotz meiner geistigen Gaben, nicht Gedanken lesen oder in die Zukunft schauen. Wird leider oft verwechselt.";"Alle könnten entspannter miteinander umgehen, weil da jemand ist der sich meldet wenn etwas schiefläuft.";"3";"GdB 60";"3";"Mensa Test; diverse Einstellungstests bei Versicherungen; Bundeswehr;";"1";"1957";"Deutschland; NRW";"Sankt Augustin";"53757";;"Mozilla/5.0 (Windows NT 10.0; Win64; x64; rv:75.0) Gecko/20100101 Firefox/75.0";;"0";"0";;"0";"5472655,5460247,5460248,5460249,5460250,5460263,5460273,5460292,5460293,5460294,5460295,5460296,5460297,5460298,5460299,5460300,5460301,5460302,5460303,5460304,5460305,5460306,5460307,5460308,5460309,5460310,5460311,5460312";"1";"0";"0";;;"de5cbd928631184585bb3500e98a99ee";"1";"0";"1588079080";"2020-04-28 13:04:40";"2020-04-28 13:33:14";"0000-00-00 00:00:00";"28";"81";"92";"0";"0";"0";"0";"0";"0";"0";"0";"0";"0";"0";"0";"0";"0";"0";"0";"0";"0";"0";"0";"0";"0";"0";"0";"0";"0";"0";"0";"0";"0";"0";"0";"0";"0";"0";"0";"0";"0";"0";"298";"316";"322";"345";"376";"778";"820";"860";"1182";"1451";"1537";"1555";"1614";"1619";"1626";"1640";"1651";"1660";"1714";"5"
"178";"0";"0";"31";"5460312";;"1295";"1";"1";"1";"1";"0";"1";"0";"1";"1";"1";"0";"1";"0";;"0";"0";"1";"1";;;;;;;;;;;;;;;;;;;;;;;;;;;;;;;;;;;;;;;;;;;;;;;;;;;;;;;;;;;;;;;;;;;;;;;;;;;;;;;;;;;;;;"1";"0";"Barrierefrei, Ruhe, im Grünen und nah am ÖPNV, guter Schallschutz, ohne Umweltgifte";"1";"0";"1";"1";"chemiefrei";"1";"viel Grün, hell";"1";"Barrierefrei ";"1";"Querdenker ";"0";;"1";"Ruhe zum Lernen";"1";"wenig Leute";"1";"wenig Geräusche ";"0";;"1";"wenige, intensive Kontakte";"0";;"1";"niedrig";"0";;"2";"2222";"6";"Rente, Unterhalt, Wohngeld ";;"1";"1";"0";"0";"1";"6";"man dann Geräusche, Gerüche der Nachbarschaft mitbekommt";;"0";"1";"0";"1";"1";"0";;"Grundriss; Lage; Baubiologie; Preis";"300";"1";"0";"1";"1";"1";"1";"0";"0";"0";"0";"1";"0";"0";"0";"0";"1";"1";"1";"7";;"ich gehbehindert bin";"Rs ginge mir besser, das wirkt soch auf die Ausstrahlung aus.";"6";;"Einzelbüro";"0";"1";"0";"1";"1";"1";"1";"4";"5";"0";"0";"0";"0";"0";"0";"0";"0";"0";"0";"1";"0";;"Landschaftsarchitektur; BWL";"1";"Landschaftsarchitektur; BWL; Informatik";"0";;"0";;"Ökologie";"7";"Unfall";"1";"chemiefrei";"1";"grün und hell";"1";"eingeschränkt ";"1";"Querdenker ";"0";;"1";"Ruhe";"0";;"1";"eingeschränkt ";"0";;"0";;"0";;"1";"niedrig";"0";;"Schnell Lösungen finden ";"Weniger auf Sozialleistungen angewiesen sein";"3";"GdB 60";"3";"Mensa-Test";"2";"1969";"Deutschland ";"Kiel";"24340";;"Mozilla/5.0 (Linux; Android 5.1.1; SM-G531F) AppleWebKit/537.36 (KHTML, like Gecko) Chrome/80.0.3987.162 Mobile Safari/537.36";;"0";"0";;"0";"5472655,5460247,5460248,5460249,5460250,5460263,5460273,5460274,5460275,5460276,5460277,5460278,5460279,5460280,5460281,5460282,5460283,5460284,5460285,5460286,5460287,5460288,5460289,5460290,5460291,5460292,5460293,5460294,5460295,5460296,5460297,5460298,5460299,5460300,5460301,5460302,5460303,5460304,5460305,5460306,5460307,5460308,5460309,5460310,5460311,5460312";"0";"0";"0";;;"2c5d51cbe197e2c01077c78711e8f42f";"1";"0";"1588079222";"2020-04-28 13:07:02";"2020-04-28 13:28:37";"0000-00-00 00:00:00";"21";"57";"71";"0";"0";"0";"0";"0";"0";"0";"0";"0";"0";"0";"0";"0";"0";"0";"0";"0";"0";"0";"0";"0";"83";"187";"195";"417";"431";"441";"485";"493";"509";"599";"614";"714";"733";"761";"775";"793";"848";"854";"883";"895";"900";"907";"919";"1017";"1033";"1046";"1141";"1168";"1207";"1221";"1242";"1247";"1255";"1263";"1273";"1289";"1295";"4"
"184";"0";"0";"31";"5460312";;"665";"1";"3";"3";"1";"1";"0";"1";"1";"1";"1";"0";"1";"0";;"0";"0";"1";"1";;;;;;;;;;;;;;;;;;;;;;;;;;;;;;;;;;;;;;;;;;;;;;;;;;;;;;;;;;;;;;;;;;;;;;;;;;;;;;;;;;;;;;"0";"1";"einigermaßen ruhig, gutes WLAN, helle räume, Wärme!! ";"1";"0";"1";"0";;"0";;"0";;"0";;"0";;"1";"eher ruhig";"0";;"0";;"0";;"1";"eher wenig oder kein Problem für andere Person, wenn man Ruhe will und Alleinsein will";"0";;"0";;"0";;;"950";"6";"Stipendium 300€ Kindergeld 204€";;"1";"0";"1";"1";"0";"6";;;"0";"1";"0";"0";"1";"0";;"Fotos  Genaue Angaben zu größe, Preis, verbrauch";"1000";"0";"0";"0";"0";"0";"0";"1";"0";"0";"0";"0";"0";"0";"0";"0";"0";"0";"1";"7";;"Kein auto";;"6";;"Nette kollegen  Interessante fordernde Tätigkeit   Immer Platz um neues zu lernen!! ";"1";"1";"0";"0";"1";"1";"1";"4";"1";"0";"0";"0";"0";"0";"0";"0";"0";"0";"1";"0";"0";;"Medizinische Laborarbeit; Krankenpflege; Gastronomie ";"0";;"0";;"1";"Medizin";"Forschung medizin";"6";;"0";;"0";;"0";;"0";;"0";;"0";;"0";;"0";;"0";;"0";;"0";;"0";;"0";;"Leistungsbereit";;"1";;"3";"Mensa IQ test";"2";"1999";"Deutschland";"München";"80336";;"Mozilla/5.0 (Linux; Android 9; HTC U11) AppleWebKit/537.36 (KHTML, like Gecko) Chrome/81.0.4044.111 Mobile Safari/537.36";;"0";"0";;"0";"5472655,5460247,5460248,5460249,5460250,5460263,5460273,5460274,5460275,5460276,5460277,5460278,5460279,5460280,5460281,5460282,5460283,5460284,5460285,5460286,5460287,5460288,5460289,5460290,5460291,5460292,5460293,5460294,5460295,5460296,5460297,5460298,5460299,5460300,5460301,5460302,5460303,5460304,5460305,5460306,5460307,5460308,5460309,5460310,5460311,5460312";"0";"1";"0";;;"9ac349c443f1463d0ebd88bc43a56607";"1";"0";"1588079891";"2020-04-28 13:18:11";"2020-04-28 13:29:16";"0000-00-00 00:00:00";"26";"53";"63";"0";"0";"0";"0";"0";"0";"0";"0";"0";"0";"0";"0";"0";"0";"0";"0";"0";"0";"0";"0";"0";"67";"129";"137";"205";"216";"231";"266";"271";"281";"301";"311";"360";"373";"396";"402";"411";"424";"428";"467";"479";"484";"491";"505";"555";"566";"576";"589";"609";"613";"617";"630";"634";"639";"647";"654";"662";"665";"3"
"186";"0";"0";"31";"5460312";;"556";"1";"3";"1";"1";"0";"1";"0";"1";"1";"0";"0";"1";"0";;"0";"0";"0";"1";;;;;;;;;;;;;;;;;;;;;;;;;;;;;;;;;;;;;;;;;;;;;;;;;;;;;;;;;;;;;;;;;;;;;;;;;;;;;;;;;;;;;;;;;;;;;;;;;;;;;;;;;;;;;;;;;;;;;;;;;;;;;;;;;;;;;;;;;;;;;;;;;;;;;;;;;;;;;;;;;;;;"Gehalt; Fenster; Parkplatz; gute Umgebung; nah am Wohnort; Kollegen; gute technische Ausstattung; Sauberkeit; Modernität";"0";"1";"0";"0";"0";"1";"0";"4";"1";"0";"0";"1";"0";"0";"0";"0";"0";"0";"1";"0";"0";;"Bildung; Wirtschaftswesen; Tourismus";"0";;"1";"Chemie";"1";"BWL";"Trendforschung; Manager; Freelancer";"6";;"0";;"1";"Möglichkeit, in die Ferne zu schauen, Ausblick";"1";"Möglichkeit, in der Mittagspause spazieren zu gehen";"0";;"0";;"1";"stetig neuer Input; keine Monotonie in Aufgaben";"1";"ehrlich; freundlich; direkt";"1";"Ruhe";"0";;"0";;"0";;"1";"produktiv";"0";;"Intelligenz und Rhetorik, Charisma";"gute Atmosphäre";"1";;"3";"Mensa-Test";"2";"1999";"Deutschland";"Berlin";"10555";;"Mozilla/5.0 (Windows NT 10.0; Win64; x64) AppleWebKit/537.36 (KHTML, like Gecko) Chrome/81.0.4044.129 Safari/537.36";;"0";"0";;"0";"5472655,5460247,5460248,5460249,5460250,5460263,5460273,5460292,5460293,5460294,5460295,5460296,5460297,5460298,5460299,5460300,5460301,5460302,5460303,5460304,5460305,5460306,5460307,5460308,5460309,5460310,5460311,5460312";"1";"1";"0";;;"025e68e6320e08c895ccf1f5aa6ea78b";"1";"0";"1588080120";"2020-04-28 13:22:00";"2020-04-28 13:31:16";"0000-00-00 00:00:00";"61";"78";"93";"0";"0";"0";"0";"0";"0";"0";"0";"0";"0";"0";"0";"0";"0";"0";"0";"0";"0";"0";"0";"0";"0";"0";"0";"0";"0";"0";"0";"0";"0";"0";"0";"0";"0";"0";"0";"0";"0";"0";"168";"184";"189";"197";"209";"246";"278";"288";"387";"424";"469";"475";"495";"498";"502";"511";"518";"550";"556";"3"
"190";"0";"0";"31";"5460312";;"1653";"1";"1";"1";"1";"1";"1";"0";"1";"1";"0";"1";"0";"0";;"0";"0";"1";"1";;;;;;;;;;;;;;;;;;;;;;;;;;;;;;;;;;;;;;;;;;;;;;;;;;;;;;;;;;;;;;;;;;;;;;;;;;;;;;;;;;;;;;"0";"1";"ruhig gelegen, tierfreundlich, naturnah, in der Nähe eines Gewässers, duftfrei, Erdgeschoss wegen Haustieren -sonst lieber Dachgeschoss";"1";"0";"0";"0";;"0";;"0";;"1";"hochbegabt";"0";;"0";;"0";;"0";;"1";"depressiv";"0";;"0";;"0";;"1";"hochsensibel";"0";"2300";"7";;"0";"1";"0";"0";"0";"0";"6";"ich schauen muss, ob die Nachbarn leise sind und sich benehmen können.";;"0";"0";"0";"0";"0";"1";"immoscout";"ruhige Lage; Schimmelfreiheit; Haustiere erlaubt; Waschmaschine in der Wohnung; ca. 60qm; Preis; möglichst keine Geräusche bei geschlossenen Fenstern von draussen";"1000";"1";"1";"0";"0";"0";"1";"0";"0";"0";"0";"0";"0";"0";"0";"0";"0";"0";"1";"5";"ich meist Auto fahre";;"Ruhe, Entspannung, Ausgeglichenheit";"6";;"Einzelbüro; nette Kollegen; selbständiges Arbeiten; Essensversorgung; kompetente Vorgesetzte; ruhige Arbeitsumgebung";"0";"0";"0";"0";"0";"0";"1";"4";"5";"1";"0";"0";"0";"0";"0";"0";"0";"0";"0";"0";"0";;"Arbeitslosenvermittlung; Beratung; Coaching";"1";"Psychologie";"1";"Mathematik, Bildungswissenschaften";"0";;"Coaching; Psychotherapie";"7";"Depression";"0";;"0";;"0";;"1";"hochbegabt";"0";;"0";;"0";;"0";;"1";"Depression";"0";;"0";;"0";;"1";"hochsensibel";"Zuhören. Einfühlen. ";"Ich könnte in Ruhe arbeiten, meine Stärken besser nutzen. Wäre weniger gestresst und viel entspannter und produktiver.";"1";;"3";"Mensa-Test";"2";"1986";"D";"Sindelfingen";"71063";;"Mozilla/5.0 (Windows NT 10.0; Win64; x64) AppleWebKit/537.36 (KHTML, like Gecko) Chrome/81.0.4044.122 Safari/537.36";;"0";"0";;"0";"5472655,5460247,5460248,5460249,5460250,5460263,5460273,5460274,5460275,5460276,5460276,5460277,5460278,5460279,5460280,5460281,5460282,5460283,5460284,5460285,5460286,5460287,5460288,5460289,5460290,5460291,5460292,5460293,5460294,5460295,5460296,5460297,5460298,5460299,5460300,5460301,5460302,5460303,5460304,5460305,5460306,5460307,5460308,5460309,5460310,5460311,5460312";"1";"1";"0";;;"70abb2005d973ef81fc7cd51618b5b82";"1";"0";"1588080482";"2020-04-28 13:28:02";"2020-04-28 13:55:35";"0000-00-00 00:00:00";"13";"33";"40";"0";"0";"0";"0";"0";"0";"0";"0";"0";"0";"0";"0";"0";"0";"0";"0";"0";"0";"0";"0";"0";"44";"131";"136";"228";"275";"358";"377";"385";"564";"595";"606";"710";"721";"737";"741";"749";"865";"872";"1138";"1146";"1151";"1155";"1160";"1194";"1207";"1219";"1252";"1413";"1524";"1612";"1621";"1624";"1628";"1632";"1639";"1650";"1653";"2"
"195";"0";"0";"31";"5460312";;"415";"1";"2";"1";"1";"1";"1";"1";"1";"1";"1";"1";"1";"0";;"0";"0";"0";"1";;;;;;;;;;;;;;;;;;;;;;;;;;;;;;;;;;;;;;;;;;;;;;;;;;;;;;;;;;;;;;;;;;;;;;;;;;;;;;;;;;;;;;;;;;;;;;;;;;;;;;;;;;;;;;;;;;;;;;;;;;;;;;;;;;;;;;;;;;;;;;;;;;;;;;;;;;;;;;;;;;;;"Einzelbüro, Platz, Blick ins Grüne";"0";"0";"1";"1";"0";"1";"0";"4";"2";"0";"0";"0";"1";"0";"0";"0";"0";"0";"0";"0";"0";;"Garten + Landschaftsbau, IT, DJ";"1";"Garten + Landschaftsbau";"1";"Studuim Sozialwissenschaften";"0";;"IT/Netzwerk, DJ";"6";;"0";;"0";;"0";;"1";"breitgestreute Hochbegabung, Mustererkennung";"0";;"0";;"0";;"0";;"0";;"0";;"0";;"0";;"0";;"Mustererkennung";"Entspannung";"1";;"3";"Mensa-Test";"1";"1963";"D";"Kassel";"34";;"Mozilla/5.0 (Windows NT 10.0; Win64; x64; rv:75.0) Gecko/20100101 Firefox/75.0";;"0";"0";;"0";"5472655,5460247,5460248,5460249,5460250,5460263,5460273,5460292,5460293,5460293,5460293,5460294,5460295,5460296,5460297,5460298,5460299,5460300,5460301,5460302,5460303,5460304,5460305,5460306,5460307,5460308,5460309,5460310,5460311,5460312";"0";"1";"0";;;"6ccf25e20f3902886cea81b1b924206c";"1";"0";"1588080708";"2020-04-28 13:31:48";"2020-04-28 13:38:43";"0000-00-00 00:00:00";"21";"50";"61";"0";"0";"0";"0";"0";"0";"0";"0";"0";"0";"0";"0";"0";"0";"0";"0";"0";"0";"0";"0";"0";"0";"0";"0";"0";"0";"0";"0";"0";"0";"0";"0";"0";"0";"0";"0";"0";"0";"0";"116";"126";"131";"142";"149";"203";"244";"252";"314";"324";"364";"369";"382";"386";"391";"394";"400";"410";"415";"3"
"196";"0";"0";"31";"5460312";;"1343";"1";"3";"3";"0";"0";"1";"0";"1";"1";"0";"1";"1";"0";;"0";"0";"1";"1";;;;;;;;;;;;;;;;;;;;;;;;;;;;;;;;;;;;;;;;;;;;;;;;;;;;;;;;;;;;;;;;;;;;;;;;;;;;;;;;;;;;;;"0";"1";"Ruhige Umgebung, Duftfrei,  keine/umgängliche Nachbarn  Tierhaltung nicht verboten";"1";"0";"1";"0";;"0";;"0";;"1";;"0";;"0";;"0";;"0";;"0";;"0";;"1";;"0";;"0";;"0";"3100";"7";;"0";"1";"0";"0";"1";"0";"7";;"Probewohnen finde ich befremdlich";"0";"0";"0";"1";"0";"0";;"Größe; Lage; Ausstattung; Preis";"500";"0";"1";"0";"0";"1";"1";"0";"1";"0";"0";"0";"0";"0";"0";"0";"0";"0";"1";"5";"Ich benutze keinen ÖPNV";;"Das kann ich nicht einschätzen.";"6";;"Homeoffice; kleine Büros; angenehme Kollegen";"0";"1";"1";"0";"1";"0";"0";"4";"5";"1";"1";"0";"0";"0";"0";"0";"0";"0";"0";"0";"0";;"Anforderungsmanagement; Testanalyse; Test";"1";"Mathematikstudium";"0";;"0";;"Test";"6";;"0";;"0";;"0";;"1";;"0";;"0";;"0";;"0";;"0";;"0";;"1";;"0";;"0";;"Ich denke i.d.R. schneller, als andere. ";"Ich wäre ausgeglichener.";"1";;"3";"Schriftlicher IQ-Test bei Mensa.";"2";"1973";"Deutschlanf";"München";"85";;"Mozilla/5.0 (Linux; Android 9; LM-V405) AppleWebKit/537.36 (KHTML, like Gecko) Chrome/81.0.4044.117 Mobile Safari/537.36";;"0";"0";;"0";"5472655,5460247,5460248,5460249,5460250,5460263,5460273,5460274,5460275,5460276,5460277,5460278,5460279,5460280,5460281,5460282,5460283,5460284,5460285,5460286,5460287,5460288,5460289,5460290,5460291,5460292,5460293,5460294,5460295,5460296,5460297,5460298,5460299,5460300,5460301,5460302,5460303,5460304,5460305,5460306,5460307,5460308,5460309,5460310,5460311,5460312";"1";"0";"0";;;"9bbde84341e72dc32e005a3bcacaaf56";"1";"0";"1588081021";"2020-04-28 13:37:01";"2020-04-28 13:59:24";"0000-00-00 00:00:00";"17";"146";"155";"0";"0";"0";"0";"0";"0";"0";"0";"0";"0";"0";"0";"0";"0";"0";"0";"0";"0";"0";"0";"0";"159";"298";"303";"627";"634";"643";"648";"653";"663";"719";"736";"785";"801";"828";"833";"854";"896";"902";"1041";"1050";"1055";"1077";"1090";"1138";"1148";"1158";"1237";"1265";"1279";"1283";"1307";"1311";"1317";"1323";"1332";"1340";"1343";"3"
"197";"0";"0";"31";"5460312";;"1209";"1";"1";"1";"0";"1";"0";"0";"1";"1";"0";"0";"1";"0";;"0";"0";"1";"1";;;;;;;;;;;;;;;;;;;;;;;;;;;;;;;;;;;;;;;;;;;;;;;;;;;;;;;;;;;;;;;;;;;;;;;;;;;;;;;;;;;;;;"1";"1";"Grüne Umgebung, Balkon/Terasse, gute Anbindung an ÖV, guter Zustand der Wohnung, Ruhe";"1";"0";"0";"1";"Wohnung sollte keinen starken Geruch haben (z. B. durch alten Teppichboden) ";"1";"Brauche Bäume etc vor dem Fenster ";"0";;"0";;"0";;"0";;"0";;"1";"Ich höre häufig Strom fließen, kann das aber ignorieren, solange ist nicht gerade eine Hochspannungsleitung direkt vorm Haus ist";"0";;"0";;"0";;"0";;"0";;"0";"2500";"7";;"0";"1";"0";"1";"0";"0";"7";;"Wohnung anschauen reicht schon, muss aber genug Zeit dafür sein, dass man sich mit den Eigenheiten der Wohnung beschäftigen kann und sich vorstellen kann, wie es eingerichtet werden könnte ";"0";"0";"1";"1";"1";"0";;"Schimmelfreiheit; Alter der Wohnung; Baustil; Wie viel Natur ist in der Umgebung; Hellhörigkeit der Wände; Größe der Wohnung; Preis; Ausstattung des Hauses";"1000";"1";"0";"1";"1";"1";"0";"0";"0";"0";"0";"0";"0";"0";"0";"0";"0";"0";"1";"7";;"ich sonst nur ein Fahrrad besitze und viek durch die Gegend reise";"Ich wäre weniger gestresst und daher freundlicher";"6";;"Kollegen; keine Großraumbüros; arbeit muss sinnvoll und abwechlungsreich sein; Gehalt";"0";"0";"1";"0";"1";"1";"0";"4";"5";"0";"1";"0";"0";"0";"0";"0";"0";"0";"0";"0";"0";;"IT; Beratung";"1";"BSc und MSc Mathematik ";"0";;"0";;"Mehr Mathematik; Theater oder irgendwas anderes Kreatives";"6";;"0";;"1";"meine augen mögen kein helles licht, was in vielen modernen büros unangenehm ist";"0";;"1";"geht wohl schneller als bei den meisten anderen";"0";;"0";;"0";;"1";"ich kann personen kaum verstehen, wenn gleichzeitig jemand anderes redet";"0";;"0";;"0";;"0";;"0";;"Intelligenz";"Ich wäre deutlich produktiver ";"1";;"3";"Test beim Lehrstuhl für Psychologie an der LMU";"2";"1995";"Deutschland ";"Hamburg";"22607";;"Mozilla/5.0 (Linux; Android 9; STF-L09) AppleWebKit/537.36 (KHTML, like Gecko) Chrome/81.0.4044.117 Mobile Safari/537.36";;"0";"0";;"0";"5472655,5460247,5460248,5460249,5460250,5460263,5460273,5460274,5460275,5460276,5460277,5460278,5460279,5460280,5460281,5460282,5460283,5460284,5460285,5460286,5460287,5460288,5460289,5460290,5460291,5460292,5460293,5460294,5460295,5460296,5460297,5460298,5460299,5460300,5460301,5460302,5460303,5460304,5460305,5460306,5460307,5460308,5460309,5460310,5460311,5460312";"0";"0";"0";;;"12f9b48bd3a003f23207ade841c3aeb0";"1";"0";"1588081388";"2020-04-28 13:43:08";"2020-04-28 14:03:17";"0000-00-00 00:00:00";"20";"75";"84";"0";"0";"0";"0";"0";"0";"0";"0";"0";"0";"0";"0";"0";"0";"0";"0";"0";"0";"0";"0";"0";"90";"200";"205";"343";"353";"382";"386";"391";"406";"462";"479";"600";"612";"645";"652";"692";"720";"744";"814";"826";"898";"902";"911";"943";"974";"990";"1116";"1124";"1143";"1147";"1179";"1183";"1188";"1195";"1200";"1204";"1209";"2"
"198";"0";"0";"31";"5460312";;"293";"1";"2";"1";"1";"1";"1";"0";"1";"1";"0";"0";"1";"0";;"0";"0";"0";"1";;;;;;;;;;;;;;;;;;;;;;;;;;;;;;;;;;;;;;;;;;;;;;;;;;;;;;;;;;;;;;;;;;;;;;;;;;;;;;;;;;;;;;;;;;;;;;;;;;;;;;;;;;;;;;;;;;;;;;;;;;;;;;;;;;;;;;;;;;;;;;;;;;;;;;;;;;;;;;;;;;;;"Gehalt, Pendeln";"0";"1";"1";"1";"1";"1";"0";"4";"6";"0";"1";"0";"0";"0";"0";"0";"0";"0";"0";"0";"0";;"Unterrichten, Marketing, Website admin";"1";"PhD, MA, BA";"0";;"0";;"Wissenschaft, Bildung";"7";"Diagnose BPD";"0";;"0";;"0";;"0";;"0";;"0";;"0";;"0";;"1";;"1";;"0";;"0";;"0";;"Mein Intellekt";"Ich wäre glücklicher";"3";"70%";"3";"IQ Test, Wechsler Scales III";"2";"1989";"Deutschland";"Möchte ich nicht angeben. NRW";"40000";;"Mozilla/5.0 (Windows NT 10.0; Win64; x64; rv:75.0) Gecko/20100101 Firefox/75.0";;"0";"0";;"0";"5472655,5460247,5460248,5460249,5460250,5460263,5460273,5460292,5460293,5460294,5460295,5460296,5460297,5460298,5460299,5460300,5460301,5460302,5460303,5460304,5460305,5460306,5460307,5460308,5460309,5460310,5460311,5460312";"1";"0";"0";;;"9c63298f9832fc88fa0def7e872fd3e1";"1";"0";"1588081429";"2020-04-28 13:43:49";"2020-04-28 13:48:42";"0000-00-00 00:00:00";"17";"31";"37";"0";"0";"0";"0";"0";"0";"0";"0";"0";"0";"0";"0";"0";"0";"0";"0";"0";"0";"0";"0";"0";"0";"0";"0";"0";"0";"0";"0";"0";"0";"0";"0";"0";"0";"0";"0";"0";"0";"0";"52";"66";"74";"79";"90";"128";"151";"185";"198";"205";"218";"225";"238";"241";"244";"251";"265";"286";"293";"3"
"200";"0";"0";"31";"5460312";;"802";"1";"2";"1";"0";"1";"1";"0";"0";"0";"0";"1";"0";"0";;"0";"0";"0";"1";;;;;;;;;;;;;;;;;;;;;;;;;;;;;;;;;;;;;;;;;;;;;;;;;;;;;;;;;;;;;;;;;;;;;;;;;;;;;;;;;;;;;;;;;;;;;;;;;;;;;;;;;;;;;;;;;;;;;;;;;;;;;;;;;;;;;;;;;;;;;;;;;;;;;;;;;;;;;;;;;;;;"Ruhig; mit 2 Kollegen; ohne Handy; naturliches Licht";"0";"0";"0";"0";"1";"0";"0";"4";"4";"0";"0";"0";"0";"0";"0";"0";"1";"0";"0";"0";"0";;"technischer Vertrieb; Projektierung von Produktionsanlagen; Konstruktion";"1";"Maschinenbau + Automatisierungstechnik";"0";;"0";;"Maschinenbau- Anlagenbau";"6";;"0";;"0";;"0";;"1";"Abstraktion; schnelles Denken";"1";"sehr gutes Gedächtnis";"1";"schnelles Lernen";"0";;"0";;"1";"nicht narzisstisch";"0";;"1";"bin nicht gabz sicher";"0";;"0";;"ich bin ein Elsässer ! (war jetzt nur Spaß)  Kreativität und lösen von komplexen technischen Problemen.  Strategisches Denken im Vertrieb";"im Beruf: optimale Leistung  Privat: frei Gedanken";"1";;"3";"Mensa";"1";"1968";"Deutschland";"Heilbronn";"74523";;"Mozilla/5.0 (Windows NT 6.1; Win64; x64; rv:75.0) Gecko/20100101 Firefox/75.0";;"0";"0";;"0";"5472655,5460247,5460248,5460249,5460250,5460263,5460273,5460292,5460293,5460294,5460295,5460296,5460297,5460298,5460299,5460300,5460301,5460302,5460303,5460304,5460305,5460306,5460307,5460308,5460309,5460310,5460311,5460312";"1";"0";"0";;;"176834bfa3b447859b9ac69c70ad120f";"1";"0";"1588081536";"2020-04-28 13:45:36";"2020-04-28 13:58:58";"0000-00-00 00:00:00";"16";"29";"35";"0";"0";"0";"0";"0";"0";"0";"0";"0";"0";"0";"0";"0";"0";"0";"0";"0";"0";"0";"0";"0";"0";"0";"0";"0";"0";"0";"0";"0";"0";"0";"0";"0";"0";"0";"0";"0";"0";"0";"162";"173";"177";"188";"195";"266";"336";"362";"510";"606";"693";"698";"720";"724";"730";"740";"748";"797";"802";"3"
"202";"0";"0";"31";"5460312";;"1034";"1";"1";"1";"1";"1";"1";"0";"0";"1";"1";"0";"0";"0";;"0";"1";"1";"0";;;;;;;;;;;;;;;;;;;;;;;;;;;;;;;;;;;;;;;;;"tolerant oder besser akzeptierend gegenüber anderen Lebensentwürfen; mitdenkend; trennt Arbeit und Privates klar";"6";"Arbeit mit Begleithund ist möglich";;"0";"1";"1";"0";"0";"1";"1";"Abschlussklassen der entsprechenden Schulen";"2";"2";"0";;"0";;"1";"schnelles Denken ist hilfreich beim Erfassen komplexer Problemstellungen, unabhängig von formalen Abschlüssen";"0";;"0";;"1";"stabile verbale Kommunikation ist ein Muss, alles andere ist verhandelbar";"0";;"0";;"1";"Mitarbeiter mit Kontaktschwierigkeiten sind in einem sozial interaktiven Beruf herausgefordert, wir versuchen hier Routine herzustellen (viele Dauerpatienten)";"1";"im therapeutischen tätigen Bereich kann die erweiterte Wahrnehmung hilfreich sein";"0";;"0";;"0";"0";"0";"1";"2";"Physiotherapie";"2";"1";"0";"Ruhe von Verkehrslärm und zu enger Nachbarschaft; Garten zumindest im Privatbereich nicht ohne technische Hilfsmittel einsehbar; verkehrsgünstige Lage für Anbindung an ÖPNV; freie Gestaltbarkeit der Immobilie bei Neubau";"1";"0";"1";"1";"keine Geruchsimmissionen jedweder Art";"1";"Schlafbereich muss vollständig zu verdunkeln sein, ohne dabei die Belüftung einzuschränken (insbes. nach Nachtschicht)";"0";;"0";;"0";;"1";"Starker Fokus = Außenreize brauchen etwas, bis sie durchdringen, z.B. laute Klingel; unterschwellige Reize insbes. Störgeräusche hindern am Erreichen des  Flow ";"0";;"1";"keine Störgeräusche von außen oder aus dem Haus";"0";;"1";"es darf nicht notwendig sein, mit Nachbarn sozial zu interagieren, um dort friedlich wohnen zu können";"0";;"0";;"0";;"2";"7350";"7";;"1800";"1";"0";"0";"0";"0";"7";;"Verlässlichkeit der Angaben des Anbieters wird vorausgesetzt";"1";"0";"1";"1";"0";"1";"Immobilienplattformen wie Immonet, Immowelt, Immobilienscout24...";"keine Maklercourtage (Ausschlusskriterium); vollständige Angaben; aussagekräftige Grundrisse und Bilder; bei besonderen Eigenschaften (z.B. Ruhe, ÖPNV-Anbindung) konkrete Angaben bzw. Messwerte";"400";"0";"0";"0";"0";"0";"0";"0";"0";"1";"1";"0";"0";"0";"0";"0";"0";"0";"1";"7";;"mittelfristig auf das Auto für den Arbeitsweg und zum Einkaufen zu verzichten kann nicht wegdiskutiert werden";"alle hätten was davon - hab ich meinen Rückzugsraum, bin ich belastbarer und leistungsfähiger und auch sozial umgänglicher";"6";;;;;;;;;;;;;;;;;;;;;;;;;;;;;;;;;;;;;;;;;;;;;;;;;;;;;;;;;;;;;;;;;;;"1";"1977";"Deutschland";"Verden";"27283";;"Mozilla/5.0 (Windows NT 10.0; Win64; x64; rv:75.0) Gecko/20100101 Firefox/75.0";;"0";"0";;"0";"5472655,5460247,5460248,5460249,5460250,5460263,5460264,5460265,5460266,5460267,5460268,5460269,5460270,5460271,5460272,5460273,5460274,5460275,5460276,5460277,5460278,5460279,5460280,5460281,5460282,5460283,5460284,5460285,5460286,5460287,5460288,5460289,5460290,5460291,5460292,5460306,5460307,5460308,5460309,5460310,5460311,5460312";"0";"0";"0";;;"8660c37b84757992aba7e5c35220b409";"1";"0";"1588081827";"2020-04-28 13:50:27";"2020-04-28 14:07:41";"0000-00-00 00:00:00";"12";"44";"55";"0";"0";"0";"0";"0";"0";"0";"0";"0";"0";"0";"0";"134";"172";"221";"228";"388";"393";"398";"411";"424";"427";"520";"524";"715";"724";"732";"736";"741";"751";"774";"808";"886";"895";"916";"924";"967";"1002";"1006";"0";"0";"0";"0";"0";"0";"0";"0";"0";"0";"0";"0";"0";"1008";"1013";"1019";"1025";"1031";"1034";"3"
