"583";"0";"0";"31";"5460312";;"592";"1";"3";"3";"0";"0";"1";"0";"1";"1";"1";"1";"1";"0";;"0";"0";"1";"1";;;;;;;;;;;;;;;;;;;;;;;;;;;;;;;;;;;;;;;;;;;;;;;;;;;;;;;;;;;;;;;;;;;;;;;;;;;;;;;;;;;;;;"0";"1";"Bezahlbar, Ruhe, ÖPNV Anbindung";"1";"0";"0";"0";;"0";;"0";;"0";;"0";;"0";;"0";;"0";;"0";;"0";;"0";;"0";;"0";;"1";"3000";"7";;"0";"1";"0";"0";"0";"1";"7";;"bei der Besichtigung alles geklärt werden kann.";"1";"0";"1";"0";"0";"0";;"Bezahlbar, ruhig, niedrigenergie bauweise";"1000";"0";"0";"0";"0";"0";"0";"0";"0";"1";"1";"1";"1";"0";"0";"0";"0";"0";"1";"7";;"kein Auto";"Entspannter leben.";"6";;"Kollegen, Forschung, Spaß";"0";"0";"1";"0";"0";"0";"0";"3";"2";"1";"0";"0";"0";"0";"0";"0";"0";"0";"0";"0";"0";;"Entomologie";"1";"Lehre";"0";;"0";;"Biodiversitätsforschung";"6";;"0";;"0";;"0";;"0";;"0";;"0";;"0";;"0";;"0";;"0";;"0";;"0";;"0";;"Ausdauer, Neugier";"Entspannung";"3";;"3";"Test in Psychiatrie";"1";"1968";"Deutschland";"Stuttgart";"70191";;"Mozilla/5.0 (Windows NT 10.0; Win64; x64) AppleWebKit/537.36 (KHTML, like Gecko) Chrome/81.0.4044.138 Safari/537.36";;"0";"0";;"0";"5472655,5460247,5460248,5460249,5460250,5460263,5460273,5460274,5460275,5460276,5460277,5460278,5460279,5460280,5460281,5460282,5460283,5460284,5460285,5460286,5460287,5460288,5460289,5460290,5460291,5460292,5460293,5460294,5460295,5460296,5460297,5460298,5460299,5460300,5460301,5460302,5460303,5460304,5460305,5460306,5460307,5460308,5460309,5460310,5460311,5460312";"0";"0";"0";;;"194c67a1f399b1f08d29cdd739f40ed2";"1";"0";"1589393055";"2020-05-13 18:04:15";"2020-05-13 18:14:07";"0000-00-00 00:00:00";"21";"48";"62";"0";"0";"0";"0";"0";"0";"0";"0";"0";"0";"0";"0";"0";"0";"0";"0";"0";"0";"0";"0";"0";"67";"103";"111";"147";"154";"163";"167";"174";"186";"220";"234";"281";"297";"323";"328";"339";"363";"369";"389";"395";"402";"414";"430";"461";"476";"485";"491";"503";"517";"524";"553";"559";"566";"573";"580";"589";"592";"2"
"587";"0";"0";"31";"5460312";;"1709";"1";"1";"3";"1";"1";"1";"1";"1";"1";"1";"0";"0";"0";;"0";"0";"1";"0";;;;;;;;;;;;;;;;;;;;;;;;;;;;;;;;;;;;;;;;;;;;;;;;;;;;;;;;;;;;;;;;;;;;;;;;;;;;;;;;;;;;;;"0";"1";"MCS geeignet, also völlig schadstoff und duftstoffrei, ländlich (ohne konventionelleLandwirtschaft ,ohne Nachbarnbzw. nur MCS Betroffene ";"1";"0";"1";"1";"Duftsstoffunverträglich";"0";;"0";;"1";"Hochbegabt";"0";;"0";;"1";"Sehr gut";"0";;"0";;"0";;"0";;"1";"durch ME/CFS nicht vorhanden";"1";"Hochsensibel, hohe soziale Kompetenz ";"2";"2.2";"6";"Erwerbsunfähigkeitsrente";;"1";"1";"0";"0";"0";"7";;"weiß ich nicht ";"0";"0";"0";"0";"0";"1";"Internet ";"Absolute Schimmelfreiheit; ökologisch gebaut; schadstofffreie Umgebung";;"0";"0";"0";"0";"0";"0";"0";"0";"1";"0";"0";"0";"0";"0";"0";"0";"0";"1";"5";"Nicht MCS geeignet (nicht duftstoff und schadstofffrei)";;"Gesundheit und Wohlbefinden ";"8";;;;;;;;;;;;;;;;;;;;;;;;;;;;;;;;;;;;;;;;;;;;;;;;;;;;;;;;;;;;;;;;;;;"2";"1962";"Deutschland ";"Siek ( bei HH)";"229";;"Mozilla/5.0 (Linux; Android 6.0.1; SAMSUNG SM-G800F) AppleWebKit/537.36 (KHTML, like Gecko) SamsungBrowser/11.1 Chrome/75.0.3770.143 Mobile Safari/537.36";;"0";"0";;"0";"5472655,5460247,5460248,5460249,5460250,5460263,5460273,5460274,5460275,5460276,5460277,5460278,5460279,5460280,5460281,5460282,5460283,5460284,5460285,5460286,5460287,5460288,5460289,5460290,5460291,5460292,5460306,5460307,5460308,5460309,5460310,5460311,5460312";"1";"0";"0";;;"c525365b0cff49367791cdb7221c307a";"1";"0";"1589470859";"2020-05-14 15:40:59";"2020-05-14 16:09:28";"0000-00-00 00:00:00";"43";"95";"118";"0";"0";"0";"0";"0";"0";"0";"0";"0";"0";"0";"0";"0";"0";"0";"0";"0";"0";"0";"0";"0";"125";"641";"659";"889";"903";"933";"968";"977";"1007";"1050";"1076";"1278";"1320";"1366";"1373";"1443";"1584";"1609";"0";"0";"0";"0";"0";"0";"0";"0";"0";"0";"0";"0";"0";"1616";"1626";"1636";"1676";"1701";"1709";"9"
"589";"0";"0";"31";"5460312";;"713";"1";"1";"1";"1";"1";"1";"1";"0";"1";"1";"1";"1";"0";;"1";"0";"0";"0";"ruhig, duftstofffrei, kein Mobiltelefon, kein WLAN, baubiologische Beratung - ggf. auch kostenlos, ";"0";"1";"0";"0";"0";;"ohne WLAN, kein Mobiltelefon, ruhig";"1";"0";"0";"2";"1";"1";"0";"0";"0";"Baumaterialien, absolute Schimmelfreiheit, Eigentümer ist als Baubiologe tätig";"5";"Objekt - Holzhaus - noch nicht ganz fertiggestellt";"300";"2";"0";"0";"0";"0";"0";"0";"0";"0";"1";"0";"0";"0";"0";"0";"0";"0";"0";"1";;;;;;;;;;;;;;;;;;;;;;;;;;;;;;;;;;;;;;;;;;;;;;;;;;;;;;;;;;;;;;;;;;;;;;;;;;;;;;;;;;;;;;;;;;;;;;;;;;;;;;;;;;;;;;;;;;;;;;;;;;;;;;;;;;;;;;;;;;;;;;;;;;;;;;;;;;;;;;;;;;;;;;;;;;;;;;;;;;;;;;;;;;;;;"1";"1944";"BRD, Bayern";"Bobingen";"86399";;"Mozilla/5.0 (Macintosh; Intel Mac OS X 10_12_6) AppleWebKit/537.36 (KHTML, like Gecko) Chrome/81.0.4044.129 Safari/537.36 OPR/68.0.3618.91";;"0";"0";;"0";"5472655,5460247,5460248,5460249,5460250,5460251,5460252,5460253,5460254,5460255,5460256,5460257,5460258,5460259,5460260,5460261,5460262,5460263,5460273,5460292,5460306,5460307,5460308,5460309,5460310,5460311,5460312";"1";"1";"0";;;"07853788da31d0589c9c08cd9a177dbc";"1";"0";"1589487018";"2020-05-14 20:10:18";"2020-05-14 20:22:11";"0000-00-00 00:00:00";"30";"86";"103";"258";"283";"366";"378";"390";"406";"469";"561";"587";"595";"635";"653";"0";"0";"0";"0";"0";"0";"0";"0";"0";"0";"0";"0";"0";"0";"0";"0";"0";"0";"0";"0";"0";"0";"0";"0";"0";"0";"0";"0";"0";"0";"0";"0";"0";"0";"0";"0";"0";"0";"0";"0";"663";"670";"682";"691";"702";"713";"10"
"593";"0";"0";"31";"5460312";;"2055";"1";"1";"1";"1";"1";"1";"1";"0";"1";"1";"1";"0";"0";;"0";"0";"1";"1";;;;;;;;;;;;;;;;;;;;;;;;;;;;;;;;;;;;;;;;;;;;;;;;;;;;;;;;;;;;;;;;;;;;;;;;;;;;;;;;;;;;;;"0";"1";"Ruhe, Duftfrei, Tierfreundlich";"1";"1";"0";"1";"Kochen";"0";;"1";"Behindertengerecht";"0";;"0";;"0";;"0";;"0";;"0";;"0";;"0";;"1";"Auftanken";"0";;"1";"860";"6";"Rente; Grundsicherung";;"1";"1";"0";"1";"0";"7";;"ich mir den Wohnraum vorher anschauen kann.";"0";"0";"0";"1";"1";"0";;"Größe der Wohnung; Höhe der Miete; Bausubstanz falls vorhanden; Energiewerte";"500";"0";"0";"0";"1";"0";"1";"0";"1";"0";"0";"1";"0";"1";"0";"0";"0";"0";"1";"7";;"ich darauf leider angewiesen bin. ";"Wenn ich mich wohlfühle, strahle ich dieses Gefühl im Freundeskreis aus.";"6";;"Kollegen; Tätigkeit; Reizreduziert; Spaß an der Arbeit";"0";"1";"0";"1";"1";"0";"0";"3";"2";"0";"0";"0";"0";"0";"0";"0";"0";"0";"0";"0";"1";"Erwerbslosenrente; 3 Berufe mit Abschluss gelernt";"Internet und Betriebssysteme; teilweise Programmierung; Mechatronikerin; breite Verwaltungspraxis; polititische Kompetenzen; Kommunalpolitikerin; Elektrik ";"1";"Mechatronikerin; Verwaltungsfachangestellte; Programmiererin Siemens-Nixdorf ";"0";;"0";;"Politik; öffentliche Verwaltung; Selbstständig ";"7";"Zum Teil gesundheitliche Einschränkungen ";"1";"Ich nehme feinste Gerüche wahr";"1";"Bildgedächnis";"0";;"1";"Kann komplexe Zusammenhänge erfassen";"1";"Hohes Erinnerungsvermögen zurückgehend bis zur Kindheit";"1";"Lernfähig  ";"1";"Sehr kommunikativ";"1";"Höre sehr gut";"0";;"1";;"0";;"0";;"0";;"Dinge, die in der Vorstellung existieren in Relation zu bringen";"Positive Auswirkung";"3";"Habe ich nicht, würde aber einen bekommen.";"4";;"2";"1963";"Deutschland ";"Hamburg";"22117";;"Mozilla/5.0 (Linux; Android 7.1.1; SM-T555) AppleWebKit/537.36 (KHTML, like Gecko) Chrome/81.0.4044.111 Safari/537.36";;"0";"0";;"0";"5472655,5460247,5460248,5460249,5460250,5460263,5460273,5460274,5460275,5460276,5460277,5460278,5460279,5460280,5460281,5460282,5460283,5460284,5460285,5460286,5460287,5460288,5460289,5460290,5460291,5460292,5460293,5460294,5460295,5460296,5460297,5460298,5460299,5460300,5460301,5460302,5460303,5460304,5460305,5460306,5460307,5460308,5460309,5460310,5460311,5460312";"1";"1";"0";;;"6ba73fbb355f15217673e40940ade52d";"1";"0";"1589632114";"2020-05-16 12:28:34";"2020-05-16 13:02:49";"0000-00-00 00:00:00";"25";"75";"90";"0";"0";"0";"0";"0";"0";"0";"0";"0";"0";"0";"0";"0";"0";"0";"0";"0";"0";"0";"0";"0";"99";"159";"170";"303";"337";"351";"388";"411";"440";"492";"517";"659";"697";"769";"780";"816";"876";"894";"1002";"1032";"1040";"1059";"1116";"1450";"1503";"1570";"1857";"1913";"1937";"1973";"1993";"2000";"2010";"2019";"2031";"2048";"2055";"4"
"594";"0";"0";"31";"5460312";;"3630";"1";"1";"1";"0";"1";"1";"1";"0";"0";"0";"0";"0";"1";"Transparenz, Klarheit";"0";"0";"1";"1";;;;;;;;;;;;;;;;;;;;;;;;;;;;;;;;;;;;;;;;;;;;;;;;;;;;;;;;;;;;;;;;;;;;;;;;;;;;;;;;;;;;;;"1";"1";"Schadstofffrei, keine Belästigung mit Zigarettenrauch, Weichspülerwolken oder ekligen Essensgerüchen von Nachbarn - gleichzeitig möchte ich mein medizinisches Cannabis vapen und geringe Mengen Parfumöl selbst nutzen, vielleicht auch mal ein bisschen Weihrauch räuchern. Sprich: Wohnraum, wo man sich nicht gegenseitig belästigt (durch Bauweise garantiert).   Fernab von großen Straßen, Tankstellen, generell: Luftverschmutzung.   Ruhig, aber nicht so, dass man nie singen oder Gitarre spielen oder Musik hören darf. ";"1";"0";"0";"1";"sensitiv, mehr Probleme mit Luftverschmutzung/Schadstoffen als dem Geruch an sich";"1";"ein bisschen lichtempfindlich. Interessiert an visueller Kunst";"1";"wenige Einschränkungen. Ich tanze gerne. Stimming. ";"1";"laut Mensa weit überdurchschnittlich intelligent, aber fällt vielleicht nicht so auf, zunehmend Konzentrationsprobleme";"1";"unzuverlässig. Manchmal sehr gut, manchmal nicht so. ";"1";"auch so, s.o. Ich kann viel schnell lernen, aber es fällt mir immer schwerer mich auf Sachen zu konzentrieren, wenn es einen Zwang gibt. ";"1";"gerne klar und präzise. Neurotypische Kommunikation tut oft meinem Gehirn weh. ";"1";"nicht extrem sensitiv. Probleme mit der Hörverarbeitung. ";"1";"mittelgradige depressive  Episode  diagnostiziert, aber auch Ängste, Angespanntheit, Isolation";"1";"eher nicht so. Ich kann anscheinend keine Gesichter lesen, und ich kann auch nicht gut einschätzen, welche Reaktion von mir angemessen wäre. ";"1";"ein bisschen. Die Zahlen von 1-10 haben Farben. Gerüche haben Texturen und Farben, aber mehr Texturen. Musik --> Bewegung/Form";"1";"begrenzt";"1";"Talente: zeichnen, singen/Musik, Sprachen, Korrekturlesen, schreiben";"0";"1218";"7";;"0";"1";"0";"0";"0";"0";"6";"um zu sehen, ob es erträglich oder gar angenehm ist. Gute Idee. ";;"0";"0";"0";"0";"0";"1";"Immobilienseiten, gezielt auf Seiten von Immobilienverwaltungen und -vermittlungen, cherryflats";"Die Angaben in der Klammer oben scheinen utopisch.   Wenn sowas angegeben werden würde und es dadurch nicht weit außerhalb meiner finanziellen Möglichkeiten rückt:  Baumaterialien; Schimmelfreiheit  Sonst (bisher):  Bad mit Fenster; kein Plastik/Laminatfußboden; Erdgeschoss oder Dachgeschoss mit Dachfenstern; bei Kauf: Hausgeld bis 250 Euro; bei Kauf: Preis bis 300.000 Euro; bei Miete: Warm bis 600 Euro; nicht an großer Straße; Blick ins Grüne; nicht in Nähe von Industrie; nicht neben Tankstelle; kein langer Arbeitsweg; gute Anbindung; Zentralheizung; Zentral-Warmwasser; mind. 1,5 Zimmer; mind. 45 m²";"500";"1";"0";"0";"0";"0";"1";"0";"0";"1";"0";"0";"0";"0";"0";"0";"1";"1";"1";"7";;"es kommt drauf an. Wenn ich zentral wohne und mit dem Fahrrad fahren kann, wäre das noch besser. Wenn ich in einer schönen Kleinstadt irgendwo einen tollen Job finde, und zu Fuß überall hinkomme, ist das auch gut. ";"Es gibt keine Menschen in meinem privaten Umfeld. Ich glaube, meinem Chef und den Leuten auf der Arbeit ist es egal, wie ich wohne. ";"6";;"Einzelbüro zumindest zeitweilig;  neurodivergente oder zumindest geistig offene Kolleg*innen und Vorgesetzte;   kein Mikromanagement;  eigener Bereich, in dem ich dann fit bin und andere beraten kann oder Auskunft geben kann;   sehr gerne in einer kulturellen, sozialen oder Bildungseinrichtung;  keine freie Wirtschaft;   flache Hierarchien;   schadstoffarmer Arbeitsplatz;  frische Luft;  Bäume vorm Fenster  ";"0";"0";"0";"0";"0";"0";"0";"4";"4";"0";"0";"1";"0";"0";"0";"0";"0";"0";"0";"0";"0";;"Schnittstelle akademischer Betrieb - Universitätsverwaltung in Sekretariat und Geschäftszimmer; Lektorat; Übersetzung Englisch-Deutsch-Englisch; Illustration; Betreuung von minderjährigen Geflüchteten; Lager;  ";"1";"B.A. Afrikanistik";"1";"Tischlerin, Glaserin, Magister Italienisch, Magister Afrikanistik";"0";;"Kunst; Kultur; Soziales (nur Verwaltung); Permakulturprojekt; freie Kunst; Café; Hofladen; Museum; Universität; Übersetzung; Illustration; Autorin; Kunstprojekt; Musikerin";"7";"ich muss Energie und Zeit für Kunst/Musik haben; ein Umfeld, bei dem ich mich nicht verstellen oder schick anziehen muss; ich baue kognitiv/organisatorisch ab und erfülle meine Aufgaben als Sekretärin nicht mehr so richtig gut. ";"1";"ich brauche frische Luft und gute Gerüche und bin stark beeinträchtigt vom Gegenteil";"1";"künstlerisches Talent";"1";"zu viel Bildschirmarbeit macht mich langsam richtig krank. Mehr Bewegung wäre gut. ";"1";"ich bin weit überdurchschnittlich intelligent (127 bei Mensa). Habe aber zunehmend kognitive Probleme, schlechter werdende Detailwahrnehmung (die war sonst immer sehr ausgeprägt). ";"1";"kaum jemand schlägt mich je im Memory, aber ich erinnere mich nur mit vielen Hilfen an Dinge, die in der Zukunft liegen";"1";"ich kann gut lernen, aber habe immer schlechtere Konzentration";"1";"ich kann gut klar und präzise formulieren und kommunizieren, finde aber neurotypische Kommunikation anstrengend.";"1";"Probleme mit der Hörverarbeitung";"1";"Depressionen, Ängste, Angespanntheit";"0";"schwierig, ich hatte schon einmal Jobs, wo es gut gepasst hat, aber aktuell nicht. Privat bin ich isoliert. Ich hätte gerne Kolleg*innen auf meiner Wellenlänge. ";"1";"1-10 --> Farben; Gerüche --> Textur/Farben; Musik --> Formen/Bewegung";"1";"gering";"1";"Sprachen (würde ich auch gerne nutzen!); Kunst (ditto!); Schreiben; Singen; Humor";"Self-enhancing humour (das ist, wenn man über sich selbst oder über katastrophale Situationen lachen kann)  Ich hab viele originelle Ideen.  Originell  hier im wörtlichen Sinn: eigene Ideen. Weil ich viel über Sachen nachdenke, Aspekte verknüpfe.   Ich war immer sehr gut mit Sprachen, aber wegen demand avoidance und sozialen Ängsten bin ich da irgendwann nicht weiter gekommen.  Ich habe ein paar Strategien, mit denen ich in kurzen Kontakten mit Menschen (Beratung, entspannter Verkauf) ganz gut fahre. Das tut mir auch gut.   Handwerkliches /künstlerisches Geschick.  Ich kann gut erklären.     ";"Ich kann mit dieser Frage nichts anfangen. Wenn ich mit Menschen zusammenarbeiten könnte, die zu mir passen, in einer Umgebung, die angenehm ist, wäre das sicherlich für alle schön? Ich habe aktuell keine privaten Kontakte. ";"1";;"2";"Mensa";"3";"1974";"Deutschland";"Hamburg";"22767";"Ich hab ein bisschen Kopfschmerzen und war beim Ausfüllen nicht sehr geduldig sondern leicht genervt (falls die Antworten genervt scheinen, daran liegt's.) ";"Mozilla/5.0 (X11; Ubuntu; Linux x86_64; rv:76.0) Gecko/20100101 Firefox/76.0";;"0";"0";;"0";"5472655,5460247,5460248,5460249,5460250,5460263,5460273,5460274,5460275,5460276,5460277,5460278,5460279,5460280,5460281,5460282,5460283,5460284,5460285,5460286,5460287,5460288,5460289,5460290,5460291,5460292,5460293,5460294,5460295,5460296,5460297,5460298,5460299,5460300,5460301,5460302,5460303,5460304,5460305,5460306,5460307,5460308,5460309,5460310,5460311,5460311,5460312";"0";"1";"0";;;"600d23b2bd017624627645e482435a2e";"1";"0";"1589640708";"2020-05-16 14:51:48";"2020-05-16 15:52:18";"0000-00-00 00:00:00";"17";"107";"115";"0";"0";"0";"0";"0";"0";"0";"0";"0";"0";"0";"0";"0";"0";"0";"0";"0";"0";"0";"0";"0";"123";"334";"341";"940";"968";"982";"986";"997";"1005";"1059";"1102";"1503";"1534";"1577";"1583";"1671";"1712";"1716";"2049";"2064";"2072";"2078";"2094";"2377";"2531";"2637";"3093";"3424";"3487";"3491";"3499";"3504";"3509";"3514";"3520";"3548";"3630";"3"
"598";"0";"0";"31";"5460312";;"1237";"1";"1";"1";"1";"0";"1";"0";"0";"0";"1";"1";"0";"0";;"0";"0";"1";"1";;;;;;;;;;;;;;;;;;;;;;;;;;;;;;;;;;;;;;;;;;;;;;;;;;;;;;;;;;;;;;;;;;;;;;;;;;;;;;;;;;;;;;"0";"1";"Ruhe; zentral; grün; kleine Wohneinheit; überschaubare Nachbarschaft";"1";"1";"1";"0";;"0";;"0";;"1";;"0";;"0";;"1";;"0";;"1";;"1";;"0";;"0";;"0";;"1";"4100";"7";;;"1";"1";"1";"0";"0";"6";"Dinge wie Geräuschkulisse, Lichteinfall nicht bei einer kurze Besichtigung bewertet werden können";;"0";"0";"0";"0";"1";"0";;"Lage; Nebenkosten; aussagekräftige Bilder";"500";"1";"0";"1";"1";"1";"0";"0";"0";"0";"0";"0";"0";"0";"0";"0";"0";"0";"1";"7";;"ich nicht ausschließlich auf ein Auto angewiesen sein möchte";"Ich bin entspannter und umgänglicher sowie leistungsfähiger.";"6";;"kleine Büroeinheiten mit maximal 3 Personen; offener Umgang miteinander; flexible Arbeitszeit; mobiles Arbeiten";"1";"1";"1";"1";"1";"1";"1";"4";"2";"1";"1";"0";"0";"0";"0";"0";"0";"0";"0";"0";"0";;"Informationstechnologie; Prozessmanagement; Training; Kommunikation";"1";"Chem.-techn.AssistentIn; Math.-techn.AssistentIn";"1";"Studium Philosphie und Geschichte";"0";;"Kommunikation";"6";;"0";;"0";;"0";;"1";;"0";;"0";;"1";;"0";;"1";;"1";;"0";;"0";;"0";;"Informationen aufnehmen und verarbeiten; Zuhören";"Ich wäre entspannt und umgänglich sowie leistungsfähiger";"1";;"3";"mehrere Tests bei Psychologen sowie Mensa";"2";"1963";"Deutschland";"Leer (Ostfriesland)";"26789";;"Mozilla/5.0 (Windows NT 10.0; Win64; x64) AppleWebKit/537.36 (KHTML, like Gecko) Chrome/81.0.4044.138 Safari/537.36";;"0";"0";;"0";"5472655,5460247,5460248,5460249,5460250,5460263,5460273,5460274,5460275,5460276,5460277,5460278,5460279,5460280,5460281,5460282,5460283,5460284,5460285,5460286,5460287,5460288,5460289,5460290,5460291,5460292,5460293,5460294,5460295,5460296,5460297,5460298,5460299,5460300,5460301,5460302,5460303,5460304,5460305,5460306,5460307,5460308,5460309,5460310,5460311,5460312";"1";"1";"0";;;"314ade22147dbf162dac2a54002df85c";"1";"0";"1589826003";"2020-05-18 18:20:03";"2020-05-18 18:40:40";"0000-00-00 00:00:00";"39";"81";"95";"0";"0";"0";"0";"0";"0";"0";"0";"0";"0";"0";"0";"0";"0";"0";"0";"0";"0";"0";"0";"0";"103";"191";"200";"255";"266";"281";"286";"292";"308";"372";"392";"500";"520";"578";"589";"666";"702";"713";"807";"835";"842";"855";"874";"989";"1014";"1022";"1047";"1088";"1142";"1146";"1185";"1190";"1199";"1209";"1224";"1233";"1237";"5"
"600";"0";"0";"31";"5460312";;"666";"1";"3";"2";"0";"0";"0";"1";"0";"1";"1";"0";"0";"0";;"0";"0";"1";"0";;;;;;;;;;;;;;;;;;;;;;;;;;;;;;;;;;;;;;;;;;;;;;;;;;;;;;;;;;;;;;;;;;;;;;;;;;;;;;;;;;;;;;"1";"0";"WLAN und Funkfrei";"1";"0";"0";"0";;"0";;"0";;"0";;"0";;"0";;"0";;"0";;"0";;"0";;"0";;"0";;"0";;"2";"2200";"6";"rente    870 E";;"1";"0";"0";"0";"0";"6";"weil ich sensiebel auf Funk und WLAN reagiere";;"1";"0";"0";"1";"0";"0";;"Schimmelfrei,Funk und WLAN frei.";"1500";"0";"0";"0";"0";"0";"0";"0";"0";"1";"0";"0";"0";"0";"0";"0";"0";"0";"1";"7";;"ich kein Auto besitze";"Eine Menge habe MCS";"6";;;;;;;;;;;;;;;;;;;;;;;;;;;;;;;;;;;;;;;;;;;;;;;;;;;;;;;;;;;;;;;;;;;"2";"1963";"Deutschland";"Lüneburg";"21335";"Wünsche dass wir von G5 verschont bleiben.Das weniger Funk auf den Markt kommt (zb.Babypuppen mit Funk für Kinder).";"Mozilla/5.0 (Macintosh; Intel Mac OS X 10_15_4) AppleWebKit/605.1.15 (KHTML, like Gecko) Version/13.1 Safari/605.1.15";;"0";"0";;"0";"5472655,5460247,5460248,5460249,5460250,5460263,5460273,5460274,5460275,5460276,5460277,5460278,5460279,5460280,5460281,5460282,5460282,5460283,5460284,5460284,5460285,5460285,5460286,5460287,5460288,5460289,5460290,5460291,5460292,5460306,5460307,5460308,5460309,5460310,5460311,5460312";"1";"1";"0";;;"a8261d29f37e7f9456e4463622cf7425";"1";"0";"1589876570";"2020-05-19 08:22:50";"2020-05-19 08:33:56";"0000-00-00 00:00:00";"32";"58";"75";"0";"0";"0";"0";"0";"0";"0";"0";"0";"0";"0";"0";"0";"0";"0";"0";"0";"0";"0";"0";"0";"84";"109";"120";"143";"155";"170";"199";"208";"216";"267";"286";"327";"393";"414";"429";"454";"491";"498";"0";"0";"0";"0";"0";"0";"0";"0";"0";"0";"0";"0";"0";"504";"514";"525";"540";"560";"666";"5"
"601";"0";"0";"31";"5460312";;"706";"1";"3";"1";"0";"0";"1";"0";"1";"0";"0";"0";"1";"0";;"0";"1";"1";"1";;;;;;;;;;;;;;;;;;;;;;;;;;;;;;;;;;;;;;;;;"Intelligenz";"7";;;"0";"0";"1";"1";"0";"1";"0";;"2";"2";"0";;"0";;"1";;"1";;"1";;"0";;"0";;"0";;"0";;"0";;"0";;"0";;"0";"0";"0";"1";"6";;"3";"0";"1";"ohne Wände und Türen";"1";"0";"1";"0";;"0";;"0";;"1";;"1";;"1";;"0";;"0";;"0";;"0";;"0";;"1";;"0";;"0";"4200";"7";;"0";"1";"0";"1";"1";"0";"7";;;"0";"1";"1";"1";"1";"0";;;;"1";"0";"1";"1";"1";"1";"1";"1";"0";"0";"1";"1";"1";"1";"0";"0";"0";"1";"5";;;;"6";;"frei wählbare Arbeitszeiten, Einzelbüro, Raucherräume, Kollegen";"0";"1";"1";"1";"1";"1";"0";"4";"2";"0";"0";"0";"0";"0";"1";"0";"0";"0";"0";"0";"0";;"Controlling, Finanzen, Rechnungswesen";"1";"Industriekaufmann";"1";"Mathematik; Physik; Informatik";"0";;;"6";;"0";;"0";;"0";;"1";;"1";;"1";;"0";;"0";;"0";;"0";;"0";;"1";;"0";;"Intelligenz";;"1";;"3";"Mensa-Test";"2";"1959";"Deutschland";"Hamburg";"2";;"Mozilla/5.0 (Windows NT 10.0; Win64; x64) AppleWebKit/537.36 (KHTML, like Gecko) Chrome/81.0.4044.138 Safari/537.36";;"0";"0";;"0";"5472655,5460247,5460248,5460249,5460250,5460263,5460264,5460265,5460266,5460267,5460268,5460269,5460270,5460271,5460272,5460273,5460274,5460275,5460276,5460277,5460278,5460279,5460280,5460281,5460282,5460283,5460284,5460285,5460286,5460287,5460288,5460289,5460290,5460291,5460292,5460293,5460294,5460295,5460296,5460297,5460298,5460299,5460300,5460301,5460302,5460303,5460304,5460305,5460306,5460307,5460308,5460309,5460310,5460311,5460312";"0";"0";"0";;;"8bc3566633bdbbd84ddd8fa8198c0c73";"1";"0";"1589974023";"2020-05-20 11:27:03";"2020-05-20 11:38:49";"0000-00-00 00:00:00";"31";"64";"80";"0";"0";"0";"0";"0";"0";"0";"0";"0";"0";"0";"0";"105";"131";"146";"156";"186";"198";"215";"222";"233";"241";"262";"272";"297";"311";"320";"327";"336";"351";"357";"368";"379";"388";"419";"425";"431";"437";"442";"490";"504";"508";"514";"530";"580";"584";"595";"612";"624";"633";"638";"657";"664";"671";"679";"689";"703";"706";"3"
"607";"0";"0";"31";"5460312";;"1217";"1";"2";"1";"1";"1";"1";"0";"0";"1";"1";"0";"0";"0";;"0";"0";"0";"1";;;;;;;;;;;;;;;;;;;;;;;;;;;;;;;;;;;;;;;;;;;;;;;;;;;;;;;;;;;;;;;;;;;;;;;;;;;;;;;;;;;;;;;;;;;;;;;;;;;;;;;;;;;;;;;;;;;;;;;;;;;;;;;;;;;;;;;;;;;;;;;;;;;;;;;;;;;;;;;;;;;;"Teilzeit; Home-Office; freie Zeiteinteilung; Computerarbeitsplatz; Toleranz; Respekt; Anerkennung; ";"1";"0";"1";"1";"1";"0";"1";"4";"3";"1";"0";"1";"0";"0";"0";"0";"0";"0";"0";"1";"0";;"Sprachen; Software-Programmierung; MS Office; Computerwissen; Beratung; Buchhandel; Werbung; Messen; ";"1";"Buchhändlerin; Wirtschaftsinformatikerin (Fachschule); Büroassistentin; Telefonberatung; Mailberatung; ";"1";"Romaistik; Anglistik; ";"0";;"Programmierung; PC-Arbeit; ";"6";;"0";;"0";;"1";"sehr beweglich;";"1";"Logisches Denken; Analytisches Denken; ";"0";;"1";"rasche Auffassungsgabe; tiefe Konzentration;";"1";"Teamfähigkeit;";"0";;"1";"Depression;";"1";"Toleranz; Unvoreingenommenheit; Freundlichkeit; Offenheit;";"0";;"0";;"0";;"hohe Intelligenz; sehr gutes logisches Denken; Toleranz; ich kann mich sehr gut in andere Menschen hineinversetzen; Sinn für Details; ";"bessere Stimmung; geregeltes Einkommen;";"3";;"2";"Mensa (130)";"2";"1958";"Deutschland";"Ludwigsburg";"71638";;"Mozilla/5.0 (Windows NT 10.0; Win64; x64; rv:76.0) Gecko/20100101 Firefox/76.0";;"0";"0";;"0";"5472655,5460247,5460248,5460249,5460250,5460263,5460273,5460292,5460293,5460294,5460295,5460296,5460297,5460298,5460299,5460300,5460301,5460302,5460303,5460304,5460305,5460306,5460307,5460308,5460309,5460310,5460311,5460312";"0";"0";"0";;;"86d638d6f291ce9fc26cff483c7e527c";"1";"0";"1590054031";"2020-05-21 09:40:31";"2020-05-21 10:00:48";"0000-00-00 00:00:00";"23";"52";"61";"0";"0";"0";"0";"0";"0";"0";"0";"0";"0";"0";"0";"0";"0";"0";"0";"0";"0";"0";"0";"0";"0";"0";"0";"0";"0";"0";"0";"0";"0";"0";"0";"0";"0";"0";"0";"0";"0";"0";"191";"217";"222";"236";"260";"546";"588";"619";"848";"949";"1095";"1102";"1141";"1146";"1153";"1159";"1166";"1211";"1217";"3"
"612";"0";"0";"31";"5460312";;"878";"1";"3";"1";"0";"1";"1";"1";"0";"0";"0";"0";"0";"0";;"0";"0";"0";"1";;;;;;;;;;;;;;;;;;;;;;;;;;;;;;;;;;;;;;;;;;;;;;;;;;;;;;;;;;;;;;;;;;;;;;;;;;;;;;;;;;;;;;;;;;;;;;;;;;;;;;;;;;;;;;;;;;;;;;;;;;;;;;;;;;;;;;;;;;;;;;;;;;;;;;;;;;;;;;;;;;;;"Individualität, Homeoffice; Interaktion; Mobilität; Erweiterbar; Plattformbasiert; ";"0";"1";"0";"0";"1";"1";"0";"4";"4";"0";"0";"0";"1";"0";"0";"0";"0";"0";"0";"0";"0";;"Finanzdienstleistung; Ausbildung";"1";"Fachwirt";"1";"Betriebswirt";"0";;"Ausbildung; Weiterbildung; Personalentwicklung;";"6";;"0";;"0";;"0";;"1";"Analytisch; Konzeptionell; ";"0";;"0";;"0";;"0";;"0";;"0";;"0";;"0";;"0";;"Ich kann Menschen lesen. Ich kann durch meine analytische und konzeptionelle Denke Menschen so betrachten, wie sie sind. Völlig wertfrei. Ich kann spüren, ob sie Ängste haben. Ich kann sehr schnell, ihre Stärken und Schwächen analysieren.";"Ich könnte Menschen anhand ihrer Stärken sehr viel besser und effizienter entwickeln und dem Arbeitsprozess zuführen und diesen Menschen mehr Erfolg im Leben geben. Es wäre somit eine win-win Situation.";"1";;"4";;"1";"1968";"Deutschland";"Hamburg";"22529";"Der Wunsch wäre es, dass diese App vielen Menschen hilft";"Mozilla/5.0 (Windows NT 10.0; Win64; x64) AppleWebKit/537.36 (KHTML, like Gecko) Chrome/81.0.4044.138 Safari/537.36 OPR/68.0.3618.125";;"0";"0";;"0";"5472655,5460247,5460248,5460249,5460250,5460263,5460273,5460292,5460293,5460294,5460295,5460296,5460297,5460298,5460299,5460300,5460301,5460302,5460303,5460304,5460305,5460306,5460307,5460308,5460309,5460310,5460311,5460312";"1";"1";"0";;;"11a89d298bb238b1007de372e6e2e99f";"1";"0";"1590163490";"2020-05-22 16:04:50";"2020-05-22 16:19:28";"0000-00-00 00:00:00";"21";"54";"66";"0";"0";"0";"0";"0";"0";"0";"0";"0";"0";"0";"0";"0";"0";"0";"0";"0";"0";"0";"0";"0";"0";"0";"0";"0";"0";"0";"0";"0";"0";"0";"0";"0";"0";"0";"0";"0";"0";"0";"200";"220";"226";"234";"241";"300";"337";"351";"424";"614";"768";"772";"785";"790";"797";"810";"817";"825";"878";"4"
