"394";"0";"0";"31";"5460312";;"903";"1";"3";"3";"0";"1";"0";"0";"1";"1";"1";"1";"1";"1";"Intuitive Bedienung (Menü, Anordnungen, etc.)";"0";"1";"0";"1";;;;;;;;;;;;;;;;;;;;;;;;;;;;;;;;;;;;;;;;;"Ehrlich; authentisch; loyal;";"6";"Familienfreundliche Arbeitsplätze, flexible Arbeitsgestaltung";;"1";"0";"0";"0";"0";"1";"0";;"2";"2";"0";;"0";;"1";"Alternative Denkweise";"1";"Effiziente Arbeitsweise";"0";;"0";;"0";;"0";;"0";;"1";;"0";;"0";;"1";"0";"0";"0";"2";"Mediengestaltung";"2";;;;;;;;;;;;;;;;;;;;;;;;;;;;;;;;;;;;;;;;;;;;;;;;;;;;;;;;;;;;;;;;;;;;;;;;;;;;;;;"Kollegen; Einzelbüro; reizreduziert;";"1";"0";"0";"0";"1";"0";"1";"4";"2";"0";"0";"0";"0";"0";"1";"0";"0";"0";"0";"0";"0";;"BWL; Mediengestaltung";"0";;"1";"BWL, Fitnessökonomie";"0";;"Wenn ich das wüsste...";"7";"Mangelnde Herausforderungen, der Alltag schleicht sich ein";"0";;"1";"Blick für's Detail";"1";"Gute Koordination";"1";"Weitreichend, gern alternativ";"1";"Zahlen kann ich mir besonders gut merken";"1";"Ich lerne sehr schnell";"1";"Ich wünsche mir keine Kommunikation mit Kunden etc. von Angesicht zu Angesicht";"0";;"0";;"0";;"1";"Sehen und Hören, Sehen und Riechen";"0";;"0";;"Sehr gute Reaktionsfähigkeit, Beidhänderin";"Ich wäre ausgeglichen und zufrieden, nicht überreizt und unruhig.";"1";;"3";"Durch einen IQ-Test bei einem Professor für Hochbegabung";"2";"1984";"Deutschland";"Hannover";"3";"Teilweise sind die Fragen nicht konkret genug und bieten zu viel Spielraum für Interpretationen.";"Mozilla/5.0 (Linux; Android 9; LG-H930 Build/PKQ1.190414.001) AppleWebKit/537.36 (KHTML, like Gecko) Chrome/69.0.3497.128 Mobile Safari/537.36 (Ecosia android@69.0.3497.128)";;"0";"0";;"0";"5472655,5460247,5460248,5460249,5460250,5460263,5460264,5460265,5460266,5460267,5460268,5460269,5460270,5460271,5460272,5460273,5460292,5460293,5460294,5460295,5460296,5460297,5460298,5460299,5460300,5460301,5460302,5460303,5460304,5460305,5460306,5460307,5460308,5460309,5460310,5460311,5460312";"0";"1";"0";;;"68fc422693e7eb3f525de38f0527df0b";"1";"0";"1588258617";"2020-04-30 14:56:57";"2020-04-30 15:12:00";"0000-00-00 00:00:00";"19";"62";"72";"0";"0";"0";"0";"0";"0";"0";"0";"0";"0";"0";"0";"111";"151";"163";"199";"301";"311";"318";"330";"345";"0";"0";"0";"0";"0";"0";"0";"0";"0";"0";"0";"0";"0";"0";"0";"0";"0";"0";"375";"420";"424";"427";"442";"493";"506";"544";"687";"751";"796";"800";"843";"847";"851";"859";"864";"871";"903";"3"
"395";"0";"0";"31";"5460312";;"1123";"1";"1";"2";"0";"1";"1";"1";"1";"1";"1";"1";"1";"0";;"0";"0";"1";"0";;;;;;;;;;;;;;;;;;;;;;;;;;;;;;;;;;;;;;;;;;;;;;;;;;;;;;;;;;;;;;;;;;;;;;;;;;;;;;;;;;;;;;"0";"1";"Wlan- und Funk-frei (DECT Full ECO), Mobilfunkfrei aber Lan Möglichkeit";"1";"0";"0";"1";"nicht im Indusriegebiet; nicht Hauptstraße; möglichst Waldgegend";"1";"naturnaher Wohnraum";"1";"Spazierengehen; wandern; Radfahrmöglichkeit";"0";;"0";;"0";;"1";"Telefonanschluss Festnetz erforderlich";"1";"Geräuscharme Umgebung";"1";"Wenig Umgebungs- und Umwelteinflüsse; keine Mobilfunkmasten";"1";"Familie";"1";"emfindlicher Geruchssinn";"1";"gering bis mittel";"0";;"2";"2200";"6";"Rente";"0";"1";"1";"0";"0";"1";"6";"ich dann die Schlafqualität testen kann";;"1";"0";"0";"1";"1";"0";;"Baumaterialien; Vorhandenes Baubiologisches Messprotokoll; Zertikate; Absolute Schimmelfreiheit; strahlungsarm; Umgebung; Anzahl der Mietparteien;";"800";"0";"1";"0";"0";"0";"1";"0";"1";"1";"1";"0";"1";"0";"0";"0";"0";"0";"1";"7";;"evtl. später keine Automobilnutzung aus Altersgründen möglich";"Meine persönlichen Anforderungen sind von gesundheitlichem Vorteil für Andere";"6";;;;;;;;;;;;;;;;;;;;;;;;;;;;;;;;;;;;;;;;;;;;;;;;;;;;;;;;;;;;;;;;;;;"2";"1952";"Deutschland - Hessen";"Marburg/ Lahn";"35080";;"Mozilla/5.0 (Windows NT 10.0; Win64; x64; rv:75.0) Gecko/20100101 Firefox/75.0";;"0";"0";;"0";"5472655,5460247,5460248,5460249,5460250,5460263,5460273,5460274,5460275,5460276,5460277,5460278,5460279,5460280,5460281,5460282,5460283,5460284,5460285,5460286,5460287,5460288,5460289,5460290,5460291,5460292,5460306,5460307,5460308,5460309,5460310,5460311,5460312";"0";"0";"0";;;"6c298452eb696ca9789997b14afaaa06";"1";"0";"1588259891";"2020-04-30 15:18:11";"2020-04-30 15:36:54";"0000-00-00 00:00:00";"34";"87";"101";"0";"0";"0";"0";"0";"0";"0";"0";"0";"0";"0";"0";"0";"0";"0";"0";"0";"0";"0";"0";"0";"106";"213";"228";"650";"658";"669";"680";"705";"715";"754";"777";"867";"909";"945";"954";"1001";"1055";"1060";"0";"0";"0";"0";"0";"0";"0";"0";"0";"0";"0";"0";"0";"1067";"1075";"1089";"1103";"1111";"1123";"4"
"396";"0";"0";"31";"5460312";;"765";"1";"1";"1";"0";"1";"1";"1";"1";"1";"1";"1";"0";"0";;"0";"0";"1";"1";;;;;;;;;;;;;;;;;;;;;;;;;;;;;;;;;;;;;;;;;;;;;;;;;;;;;;;;;;;;;;;;;;;;;;;;;;;;;;;;;;;;;;"0";"1";"Ruhe, keine Hellhörigkeit, gute Dämmung, W-lanfrei, vegan";"1";"0";"0";"1";"sehr gut, sehr empfindsam";"1";"sehr gut, keine aggressiven Farben";"0";;"0";;"0";;"0";;"0";;"1";"sehr gut, sehr empfindsam";"0";;"0";;"1";"bin Synästhetikerin (Hören/Farben; Fühlen/Farben)";"1";"sehr gering";"0";;"1";"1000";"6";"Sozialhilfe";;"1";"1";"0";"0";"1";"6";"um die Hellhörigkeit der Wohnung zu testen";;"0";"0";"0";"1";"1";"0";;"Baujahr";"500";"1";"0";"0";"0";"0";"0";"0";"0";"0";"0";"0";"0";"0";"0";"0";"0";"0";"1";"7";;"ich kein Auto besitze";"mir würde es besser gehen";"6";;"Einzelbüro; Ruhe; Ruheraum, Reizreduziert";"0";"0";"0";"0";"0";"1";"1";"4";"4";"0";"0";"0";"0";"0";"0";"0";"0";"1";"0";"0";"0";;"Erzieherin; Rehabilitationspädagigin";"0";;"0";;"1";"Rehabilitationspädagogin";"Rehabilitationspädagogin";"6";;"1";"sehr gut, sehr empfindsam";"1";"sehr gut";"0";;"0";;"0";;"0";;"0";;"1";"sehr gut, sehr empfindsam";"0";;"0";;"1";"Synästhetikerin (Hören/Farbe; Fühlen/Farbe)";"1";"gering";"0";;"Synästhesie";"mehr Leistung meinerseits";"1";;"0";;"2";"1980";"Deutschland";"Berlin";"10439";;"Mozilla/5.0 (Windows NT 10.0; Win64; x64; rv:75.0) Gecko/20100101 Firefox/75.0";;"0";"0";;"0";"5472655,5460247,5460248,5460249,5460250,5460263,5460273,5460274,5460275,5460276,5460277,5460278,5460279,5460280,5460281,5460282,5460283,5460284,5460285,5460286,5460287,5460288,5460289,5460290,5460291,5460292,5460293,5460294,5460295,5460296,5460297,5460298,5460299,5460300,5460301,5460302,5460303,5460304,5460305,5460306,5460307,5460308,5460309,5460310,5460311,5460312";"0";"0";"0";;;"43013d47e8672dee4796ae6bcddfd6cd";"1";"0";"1588260071";"2020-04-30 15:21:11";"2020-04-30 15:33:56";"0000-00-00 00:00:00";"21";"57";"70";"0";"0";"0";"0";"0";"0";"0";"0";"0";"0";"0";"0";"0";"0";"0";"0";"0";"0";"0";"0";"0";"75";"116";"128";"234";"240";"255";"270";"276";"288";"310";"327";"346";"356";"382";"389";"408";"430";"437";"477";"489";"496";"504";"520";"556";"569";"591";"678";"691";"709";"713";"722";"727";"733";"741";"748";"759";"765";"3"
"397";"0";"0";"31";"5460312";;"425";"1";"3";"1";"1";"0";"1";"0";"1";"0";"0";"0";"1";"0";;"0";"0";"0";"1";;;;;;;;;;;;;;;;;;;;;;;;;;;;;;;;;;;;;;;;;;;;;;;;;;;;;;;;;;;;;;;;;;;;;;;;;;;;;;;;;;;;;;;;;;;;;;;;;;;;;;;;;;;;;;;;;;;;;;;;;;;;;;;;;;;;;;;;;;;;;;;;;;;;;;;;;;;;;;;;;;;;"Ruhe; Möglichkeit zur kreativen Arbeit; Strukturiertheit; Möglichkeit Struktur zu schaffen";"0";"1";"0";"1";"1";"0";"0";"4";"4";"1";"0";"0";"0";"0";"0";"0";"0";"0";"1";"0";"0";;"Einkauf; Projektmanagement";"0";;"0";;"1";"Wirtschaftsingenieurwesen B.Sc.";"Projektmanagement; Prozessoptimierung";"7";"Hochbegabung, ADHS";"0";;"0";;"0";;"1";"Abneigung gegen Eintönigkeit";"0";;"1";"leicht ablenkbar; Hyperfokus bei interessanten Aufgaben";"1";"Direkte Kommunikation; gute Fehlerkultur";"1";"wenig Nebengeräusche";"0";;"0";;"0";;"0";;"0";;"Um die Ecke denken und Dinge strukturieren";"Mehr Vertrauen in meine eigenen Fähigkeiten, Spaß bei der Arbeit und dadurch eine stark erhöhte Leistungsfähigkeit";"1";;"3";"IQ-Test von Mensa";"2";"1997";"Deutschland, NRW";"Duisburg";"47";;"Mozilla/5.0 (Windows NT 10.0; Win64; x64) AppleWebKit/537.36 (KHTML, like Gecko) Chrome/81.0.4044.129 Safari/537.36";;"0";"0";;"0";"5472655,5460247,5460248,5460249,5460250,5460263,5460273,5460292,5460293,5460294,5460295,5460296,5460297,5460298,5460299,5460300,5460301,5460302,5460303,5460304,5460305,5460306,5460307,5460308,5460309,5460310,5460311,5460312";"1";"1";"0";;;"f885e3607e8034922e9700b8899f1c97";"1";"0";"1588260424";"2020-04-30 15:27:04";"2020-04-30 15:34:09";"0000-00-00 00:00:00";"17";"39";"50";"0";"0";"0";"0";"0";"0";"0";"0";"0";"0";"0";"0";"0";"0";"0";"0";"0";"0";"0";"0";"0";"0";"0";"0";"0";"0";"0";"0";"0";"0";"0";"0";"0";"0";"0";"0";"0";"0";"0";"103";"112";"120";"128";"150";"183";"202";"227";"316";"333";"363";"366";"382";"387";"392";"399";"404";"420";"425";"3"
"398";"0";"0";"31";"5460312";;"789";"1";"2";"3";"1";"1";"1";"0";"1";"1";"1";"0";"1";"0";;"0";"0";"1";"1";;;;;;;;;;;;;;;;;;;;;;;;;;;;;;;;;;;;;;;;;;;;;;;;;;;;;;;;;;;;;;;;;;;;;;;;;;;;;;;;;;;;;;"1";"1";"Möglichst duftfrei wäre gut, tierfreundlich wäre wichtig, vegetarisch oder vegan wäre nett. Außerdem sollten laute, hohe Motorgeräusche vermieden werden, wenn es bspw. elektrische Rollläden o. ä. gibt.";"1";"1";"1";"0";;"0";;"0";;"1";"Ich denke oft sehr detailorientiert.";"1";"Ich erinnere mich oft sehr detailliert (detaillierter ale andere) an zurückliegende Ereignisse.";"0";;"1";"Manchmal verstehe ich Dinge zu wörtlich (aber selten so schlimm, dass es Kommunikation wirklich erschwert).";"1";"Ich höre sehr genau, und bin extrem überempfindlich gegenüber bestimmten Arten von Geräuschen (die sind mir dann sehr unangenehm).";"1";"Ich muss mich ab und zu zurückziehen können, um meine Ruhe zu haben, damit es mir gut geht.";"1";"Ich habe Probleme, soziale Beziehungen aufzubauen, d. h. bin oft langsamer darin als der Durchschnittsmensch.";"0";;"0";;"0";;"1";"3200";"7";;;"1";"0";"0";"1";"1";"7";;;"1";"1";"1";"1";"1";"0";;"Genügend Fotos; Informationen über Bausubstanz; Schimmelfreiheit; Rauchfreiheit";"800";"1";"1";"1";"1";"1";"1";"0";"0";"0";"0";"0";"0";"1";"0";"0";"0";"0";"1";"7";;"ich mich vor allem mit dem Fahrrad oder mit öffentlichen Verkehrsmitteln fortbewege.";;"6";;"Ruhige Arbeitsumgebung, am besten Einzel- oder Zweierbüro";"1";"1";"1";"0";"1";"1";"0";"4";"6";"1";"0";"1";"0";"0";"0";"0";"0";"0";"0";"0";"0";;"Forschung und Lehre (Mathematik / Physik)";"1";"Bachelor of Science Physik, Master of Advanced Study (Angewandte) Mathematik, Promotion Physik (fast abgeschlossen)";"0";;"0";;"Forschung und Lehre";"6";;"0";;"0";;"0";;"1";"Siehe erster Teil.";"1";"Siehe erster Teil.";"0";;"1";"Siehe erster Teil.";"1";"Siehe erster Teil.";"1";"Siehe erster Teil.";"1";"Siehe erster Teil.";"0";;"0";;"0";;"Ich kann sehr gut lange und konzentriert logisch denken, analysieren.";;"1";;"3";"Psychologischer Test per Fragebögen";"1";"1994";"Deutschland";"Hannover";"30657";;"Mozilla/5.0 (Windows NT 6.1; rv:75.0) Gecko/20100101 Firefox/75.0";;"0";"0";;"0";"5472655,5460247,5460248,5460249,5460250,5460263,5460273,5460274,5460275,5460275,5460275,5460276,5460277,5460278,5460279,5460280,5460281,5460282,5460283,5460284,5460285,5460286,5460287,5460288,5460289,5460290,5460291,5460292,5460293,5460294,5460295,5460296,5460297,5460298,5460299,5460300,5460301,5460302,5460303,5460304,5460305,5460306,5460307,5460308,5460309,5460310,5460311,5460312";"0";"1";"0";;;"f32dcf36e9fda26bfc0bf3e0d382085e";"1";"0";"1588261398";"2020-04-30 15:43:18";"2020-04-30 15:56:27";"0000-00-00 00:00:00";"14";"29";"35";"0";"0";"0";"0";"0";"0";"0";"0";"0";"0";"0";"0";"0";"0";"0";"0";"0";"0";"0";"0";"0";"39";"131";"137";"314";"321";"339";"342";"347";"360";"368";"376";"412";"429";"476";"479";"506";"516";"520";"550";"569";"572";"579";"594";"651";"657";"663";"695";"729";"732";"735";"759";"764";"768";"774";"780";"786";"789";"2"
"399";"0";"0";"31";"5460312";;"575";"1";"3";"1";"0";"1";"1";"0";"1";"1";"1";"1";"1";"0";;"0";"1";"1";"1";;;;;;;;;;;;;;;;;;;;;;;;;;;;;;;;;;;;;;;;;"Rational;hochbegabt";"7";;;"0";"1";"1";"1";"1";"0";"0";;"2";"2";"0";;"0";;"1";"Out of the box Denken";"0";;"0";;"0";;"0";;"0";;"0";;"0";;"0";;"0";;"0";"0";"1";"1";"5";"Risikocontrolling";"2";"0";"1";"Verkehrsgünstig;gute Infrastruktur";"1";"0";"0";"0";;"0";;"0";;"0";;"0";;"0";;"0";;"0";;"0";;"0";;"0";;"0";;"0";;"2";"5000";"7";;"0";"1";"1";"1";"0";"0";"7";;"ich mir im Vorfeld eine ausreichende Meinung bilden kann";"0";"1";"1";"1";"1";"0";;;"500";"0";"0";"0";"0";"0";"1";"0";"0";"0";"0";"1";"1";"1";"1";"0";"0";"0";"1";"7";;"ich möglichst nicht mit dem Auto fahren möchte";;"6";;"Leise;hell";"1";"1";"1";"1";"1";"1";"0";"4";"6";"1";"1";"0";"0";"0";"0";"0";"0";"0";"0";"0";"0";;"Finanzen;Banking";"1";"Studium Mathematik";"0";;"0";;"Bank;IT";"6";;"0";;"0";;"0";;"1";"parallel denken;Hochbegabung";"0";;"1";"schnelles Erfassen von Texten und Zahlen";"1";"Einfühlungsvermögen";"1";"mehreren Gesprächen gleichzeitig zuhören, Hörvermögen +10db besser als Durchschnitt";"0";;"0";;"0";;"0";;"0";;"Extrem schnelles analytisches Denken";;"1";;"3";"CFT20R beim Psychiater";"1";"1976";"Deutschland";"München";"81675";;"Mozilla/5.0 (Windows NT 10.0; Win64; x64; rv:75.0) Gecko/20100101 Firefox/75.0";;"0";"0";;"0";"5472655,5460247,5460248,5460249,5460250,5460263,5460264,5460264,5460264,5460265,5460266,5460267,5460268,5460269,5460270,5460271,5460272,5460273,5460274,5460275,5460276,5460277,5460278,5460279,5460280,5460281,5460282,5460283,5460284,5460285,5460286,5460287,5460288,5460289,5460290,5460291,5460292,5460293,5460293,5460293,5460294,5460295,5460296,5460297,5460298,5460299,5460300,5460301,5460302,5460303,5460304,5460305,5460306,5460307,5460308,5460309,5460310,5460311,5460312";"1";"1";"0";;;"2980dcdf2746268b2d12c04fc8ed51b3";"1";"0";"1588261457";"2020-04-30 15:44:17";"2020-04-30 15:53:52";"0000-00-00 00:00:00";"13";"37";"51";"0";"0";"0";"0";"0";"0";"0";"0";"0";"0";"0";"0";"71";"80";"89";"96";"117";"124";"132";"152";"156";"161";"181";"187";"199";"204";"244";"249";"253";"263";"279";"286";"292";"297";"312";"318";"342";"346";"350";"367";"374";"379";"382";"390";"416";"422";"427";"497";"512";"521";"525";"539";"544";"550";"556";"563";"574";"575";"2"
"402";"0";"0";"31";"5460312";;"1275";"1";"1";"1";"0";"1";"1";"0";"1";"0";"1";"1";"0";"0";;"0";"0";"1";"1";;;;;;;;;;;;;;;;;;;;;;;;;;;;;;;;;;;;;;;;;;;;;;;;;;;;;;;;;;;;;;;;;;;;;;;;;;;;;;;;;;;;;;"1";"1";"Biologische Baumaterialien; keine Kunststoffe; keine Lösemittel; keine Duftstoffe; keine Klimaanlage; gute Luftverhältnisse";"1";"0";"0";"1";"sehr geruchsempfindlich gegen chemische Stoffe; Putzmittel; Parfum; Waschmittel; Abgase";"0";;"0";;"0";;"0";;"0";;"0";;"0";;"0";;"0";;"0";;"0";;"1";"sehr Einfühlsam";;;"7";;;"1";"0";"0";"1";"0";"6";"die Luftverhältnisse in der Wohnung ok sind.";;"1";"0";"0";"0";"1";"0";;"Baubiologisches Messprotokoll; Informationen über die Baumaterialien";;"0";"0";"0";"0";"1";"0";"0";"0";"0";"0";"0";"0";"0";"0";"0";"0";"0";"0";"7";;"Falls Auto ausfällt";;"6";;"gute Luftverhältnisse; chemiefrei";"1";"0";"0";"0";"0";"1";"1";"3";"2";"0";"0";"1";"0";"0";"0";"0";"0";"0";"0";"0";"0";;"kaufmännische; pädagogisch";"0";;"0";;"0";;;"7";"schlechte Luftverhältnisse im Büro";"1";"chemiefreie Luft";"0";;"0";;"0";;"0";;"0";;"0";;"0";;"0";;"0";;"0";;"0";;"0";;;;"1";;"0";;"2";;"Deutschland";;;;"Mozilla/5.0 (Windows NT 10.0; Win64; x64; rv:75.0) Gecko/20100101 Firefox/75.0";;"0";"0";;"0";"5472655,5460247,5460248,5460249,5460250,5460263,5460273,5460274,5460275,5460276,5460277,5460278,5460279,5460280,5460281,5460282,5460283,5460284,5460285,5460286,5460287,5460288,5460289,5460290,5460291,5460292,5460293,5460294,5460295,5460296,5460297,5460298,5460299,5460300,5460301,5460302,5460303,5460304,5460305,5460306,5460307,5460308,5460309,5460310,5460311,5460312";"0";"0";"0";;;"7c19df586429200800f2a6e9cd04291a";"1";"0";"1588265543";"2020-04-30 16:52:23";"2020-04-30 17:13:38";"0000-00-00 00:00:00";"32";"151";"166";"0";"0";"0";"0";"0";"0";"0";"0";"0";"0";"0";"0";"0";"0";"0";"0";"0";"0";"0";"0";"0";"178";"349";"366";"597";"618";"628";"639";"645";"667";"730";"749";"826";"839";"862";"869";"896";"928";"935";"1024";"1037";"1046";"1061";"1082";"1111";"1125";"1166";"1210";"1215";"1224";"1230";"1245";"1251";"1255";"1265";"1269";"1271";"1275";"4"
"404";"0";"0";"31";"5460312";;"683";"1";"3";"1";"0";"1";"1";"0";"0";"0";"1";"1";"0";"0";;"0";"0";"1";"1";;;;;;;;;;;;;;;;;;;;;;;;;;;;;;;;;;;;;;;;;;;;;;;;;;;;;;;;;;;;;;;;;;;;;;;;;;;;;;;;;;;;;;"0";"1";"Ruhig  Rollos vor den Fenstern, um Raum komplett abzudunkeln";"1";"0";"1";"1";"Nehme mehr Gerüche als andere wahr";"1";"Lichtempfindlichkeit, daher Abdunkeln wichtig";"0";;"0";;"0";;"0";;"0";;"1";"Nehme mehr Geräusche als andere wahr, daher großes Bedürfnis nach Ruhe";"1";"Rückzugsmöglichkeiten wichtig";"1";"Rückzugsmöglichkeiten wichtig";"0";;"1";"Rückzugsmöglichkeiten wichtig";"0";;"2";"5000";"7";;;"1";"0";"1";"0";"0";"6";;;"0";"0";"0";"1";"1";"0";;;"500";"0";"0";"0";"0";"1";"1";"0";"1";"1";"1";"0";"0";"0";"0";"0";"0";"0";"1";"7";;"ich kein Auto besitze";;"7";;"Reizreduziert; Klar strukturiert";"0";"1";"1";"1";"1";"1";"0";"4";"5";"1";"1";"0";"0";"0";"0";"0";"0";"0";"0";"0";"0";;"Regulatory Affairs";"1";"Ernährungswissenschaften";"0";;"0";;"Regulatory Affairs";"7";"Vorhersehbarkeit; Struktur";"0";;"0";;"0";;"0";;"0";;"0";;"0";;"0";;"0";;"0";;"0";;"0";;"0";;;;"0";;"0";;"0";;;;;;"Mozilla/5.0 (Windows NT 10.0; Win64; x64) AppleWebKit/537.36 (KHTML, like Gecko) Chrome/80.0.3987.163 Safari/537.36 OPR/67.0.3575.137";;"0";"0";;"0";"5472655,5460247,5460248,5460249,5460250,5460263,5460273,5460274,5460275,5460276,5460277,5460278,5460278,5460279,5460280,5460281,5460282,5460283,5460284,5460285,5460286,5460287,5460288,5460289,5460290,5460291,5460292,5460293,5460294,5460295,5460296,5460297,5460298,5460299,5460300,5460301,5460302,5460303,5460304,5460305,5460306,5460307,5460308,5460309,5460310,5460311,5460312";"0";"0";"0";;;"9053005693aa3a91c3e166392ff90b7c";"1";"0";"1588266813";"2020-04-30 17:13:33";"2020-04-30 17:24:56";"0000-00-00 00:00:00";"16";"50";"58";"0";"0";"0";"0";"0";"0";"0";"0";"0";"0";"0";"0";"0";"0";"0";"0";"0";"0";"0";"0";"0";"62";"139";"146";"325";"334";"349";"355";"359";"368";"381";"393";"399";"413";"442";"446";"456";"464";"470";"523";"535";"541";"546";"556";"578";"597";"648";"657";"659";"661";"664";"669";"672";"673";"676";"678";"680";"683";"2"
"405";"0";"0";"31";"5460312";;"1162";"1";"3";"3";"1";"0";"1";"0";"1";"1";"1";"1";"1";"0";;"0";"0";"1";"0";;;;;;;;;;;;;;;;;;;;;;;;;;;;;;;;;;;;;;;;;;;;;;;;;;;;;;;;;;;;;;;;;;;;;;;;;;;;;;;;;;;;;;"1";"0";"Ruhig, Hell, Aufzug vorhanden, gute Anbindung an ÖPNV, Parkmöglichkeiten, Hausmeisterservice, Wärme- und Schallgedämmt, nicht zu viele Wohneinheiten";"1";"1";"1";"0";;"0";;"0";;"1";"Querdenken";"0";;"1";"Hohe Konzentration nur bei absoluter Ruhe";"0";;"1";"Ich höre sehr leise Geräusche, Schlafstörung bei Geräuschen";"0";;"1";"Nicht zu viele auf einmal, braucht Pausen";"0";;"1";"Stark schwankend ";"0";;"2";"3500";"7";;"500";"1";"0";"1";"0";"0";"7";;"Ich nicht in fremden Möbel wohnen möchten";"0";"0";"0";"0";"1";"0";;"Informationen zur Lage, Fotos, Schimmelfreiheit";"1000";"0";"0";"1";"0";"0";"0";"0";"0";"1";"1";"1";"1";"0";"0";"0";"0";"0";"1";"7";;"Ich ungerne Auto fahre";"Ich wäre zufrieden und ausgeglichen. Ich hätte mehr Energie für meinen Job und meine Freunde. ";"6";;;;;;;;;;;;;;;;;;;;;;;;;;;;;;;;;;;;;;;;;;;;;;;;;;;;;;;;;;;;;;;;;;;"2";"1983";"Deutschland ";"Düsseldorf";;;"Mozilla/5.0 (iPhone; CPU iPhone OS 13_3_1 like Mac OS X) AppleWebKit/605.1.15 (KHTML, like Gecko) Version/13.0.5 Mobile/15E148 Safari/604.1";;"0";"0";;"0";"5472655,5460247,5460248,5460249,5460250,5460263,5460273,5460274,5460275,5460276,5460277,5460278,5460279,5460280,5460281,5460282,5460283,5460284,5460285,5460286,5460287,5460288,5460289,5460290,5460291,5460292,5460306,5460307,5460308,5460309,5460310,5460311,5460312";"0";"1";"0";;;"e4cfa090fa1501f2e46aa6b6655e7f19";"1";"0";"1588267075";"2020-04-30 17:17:55";"2020-04-30 17:37:17";"0000-00-00 00:00:00";"21";"81";"94";"0";"0";"0";"0";"0";"0";"0";"0";"0";"0";"0";"0";"0";"0";"0";"0";"0";"0";"0";"0";"0";"98";"310";"317";"557";"590";"618";"629";"652";"661";"704";"726";"794";"845";"948";"958";"996";"1063";"1067";"0";"0";"0";"0";"0";"0";"0";"0";"0";"0";"0";"0";"0";"1072";"1077";"1084";"1107";"1147";"1162";"3"
"407";"0";"0";"31";"5460312";;"1481";"1";"1";"1";"1";"1";"1";"1";"0";"0";"0";"1";"0";"0";;"0";"0";"1";"1";;;;;;;;;;;;;;;;;;;;;;;;;;;;;;;;;;;;;;;;;;;;;;;;;;;;;;;;;;;;;;;;;;;;;;;;;;;;;;;;;;;;;;"0";"1";"Wlan- und Funkfrei, Duftstofffrei, Tierfreundlich, Schadstofffreiebaumaterialien (wie auch Bodenbeläge, Farben etc.), ruhig (kein Lärm durch Nachbarn, von außen), energieefizient, mit Pkw erreichbar (Stellplatz)";"1";"0";"0";"0";;"0";;"0";;"0";;"0";;"0";;"0";;"0";;"0";;"0";;"0";;"0";;"0";;"1";"1500";"6";;;"1";"1";"1";"1";"1";"6";"ich sichergehen muss, ob ich die Umgebung vertrage und ichn mich dort wohlfühle";;"1";"0";"0";"0";"0";"0";;"Lage, Größe, Preis, Alter, Wohneinheiten, Bauweise, - materialien, (s.o)";"1000";"1";"0";"0";"0";"0";"0";"0";"1";"0";"0";"0";"0";"0";"0";"0";"0";"0";"1";"7";;"um Mobil und nicht unbedingt auf das Auto angewiesen zu sein";"für mich gesundheitliche Besserung, dadurch mehr Leistungsfähigkeit und etv. wieder Arbeitsfähigkeit";"6";;"Duftstofffrei, Schadstofffrei, Wlan-, Funkfrei. flexibles Arbeiten, gutes Arbeitsklima";"1";"1";"0";"0";"1";"0";"1";"4";"2";"0";"0";"0";"0";"0";"0";"0";"0";"0";"0";"1";"0";;"Vereinsarbeit";"1";"Datenverarbeitungskauffrau, Wirtschaftsinformatikassistentin";"0";;"0";;;"6";;"0";;"0";;"0";;"1";"analytisches Denken";"0";;"1";"selbständig, konzentriert, zielorientiert";"1";"Fremdsprachen Englisch, Dänisch, Französisch";"0";;"1";"vorhanden";"0";;"0";;"0";;"0";;"Beharrlichkeit, Zuverlässigkeit, Aufgabenorientiert";"Zufriedenheit, unetrstützung";"3";;"4";;"2";"1969";"Deutschland";"Kiel";"24937";;"Mozilla/5.0 (Windows NT 6.3; Win64; x64; rv:75.0) Gecko/20100101 Firefox/75.0 TO-Browser/TOB7.75.0.102_04";;"0";"0";;"0";"5472655,5460247,5460248,5460249,5460250,5460263,5460273,5460274,5460275,5460276,5460277,5460278,5460279,5460280,5460281,5460282,5460283,5460284,5460285,5460286,5460287,5460288,5460289,5460290,5460291,5460292,5460293,5460294,5460295,5460296,5460297,5460298,5460299,5460300,5460301,5460302,5460303,5460304,5460305,5460306,5460307,5460308,5460309,5460310,5460311,5460312";"1";"1";"0";;;"9d2da4269e09ae003d64b765686f5727";"1";"0";"1588267852";"2020-04-30 17:30:52";"2020-04-30 17:55:33";"0000-00-00 00:00:00";"28";"102";"114";"0";"0";"0";"0";"0";"0";"0";"0";"0";"0";"0";"0";"0";"0";"0";"0";"0";"0";"0";"0";"0";"118";"407";"417";"476";"485";"494";"501";"512";"526";"581";"595";"684";"714";"748";"758";"807";"874";"880";"1002";"1014";"1019";"1030";"1042";"1115";"1161";"1178";"1277";"1382";"1408";"1413";"1427";"1432";"1441";"1450";"1458";"1477";"1481";"3"
"410";"0";"0";"31";"5460312";;"379";"1";"2";"3";"0";"1";"1";"0";"1";"1";"1";"0";"0";"0";;"0";"0";"0";"1";;;;;;;;;;;;;;;;;;;;;;;;;;;;;;;;;;;;;;;;;;;;;;;;;;;;;;;;;;;;;;;;;;;;;;;;;;;;;;;;;;;;;;;;;;;;;;;;;;;;;;;;;;;;;;;;;;;;;;;;;;;;;;;;;;;;;;;;;;;;;;;;;;;;;;;;;;;;;;;;;;;;"Keine. Ich habe eine erfüllende Arbeit. Wäre nur ggf. neugierig, ob es Aufträge gibt, die für mich mit meinen Fähigkeiten, interessant und spannend sein könnten. Reine Neugierde, meine Fähigkeiten anzubringen.";"0";"0";"0";"0";"0";"0";"0";"4";"5";"0";"0";"0";"1";"0";"0";"0";"0";"0";"0";"0";"0";;"Psychotherapie; (Übersetzungen, Transkriptionen, Vorlesen)";"1";"Diplom-Psychologie";"0";;"0";;;"0";;"0";;"1";"Teilweise rel. fotografisches Gedächtnis, sehr gute Detailwahrnehmung";"0";;"1";"Hochbegabt. Schnelles, vernetztes, flexibles, kreatives Denken; finde gerne Fehler und Problemlösungen";"1";"teilweise wörtlich. Räumliches Erinnern.";"1";;"0";;"0";;"1";;"0";;"1";;"0";;"0";;;;"1";;"3";"Mensa-Gruppentest";"2";"1973";"Deutschland NRW";"Köln";"50931";;"Mozilla/5.0 (Windows NT 10.0; Win64; x64) AppleWebKit/537.36 (KHTML, like Gecko) Chrome/70.0.3538.102 Safari/537.36 Edge/18.18363";;"0";"0";;"0";"5472655,5460247,5460248,5460249,5460250,5460263,5460273,5460292,5460293,5460293,5460293,5460294,5460295,5460296,5460297,5460298,5460299,5460300,5460301,5460302,5460303,5460304,5460305,5460306,5460307,5460308,5460309,5460310,5460311,5460312";"1";"1";"0";;;"fa202a91aa537870bd0b0dec02a356e0";"1";"0";"1588274313";"2020-04-30 19:18:33";"2020-04-30 19:24:52";"0000-00-00 00:00:00";"26";"59";"69";"0";"0";"0";"0";"0";"0";"0";"0";"0";"0";"0";"0";"0";"0";"0";"0";"0";"0";"0";"0";"0";"0";"0";"0";"0";"0";"0";"0";"0";"0";"0";"0";"0";"0";"0";"0";"0";"0";"0";"123";"129";"135";"142";"147";"197";"201";"212";"304";"317";"326";"330";"342";"349";"354";"360";"366";"376";"379";"3"
"412";"0";"0";"31";"5460312";;"596";"1";"2";"3";"0";"1";"1";"0";"0";"0";"0";"1";"0";"0";;"0";"1";"0";"0";;;;;;;;;;;;;;;;;;;;;;;;;;;;;;;;;;;;;;;;;"Nichtraucher; Wlan und Handy nur soviel wie nötig;";"7";;;"0";"0";"0";"0";"0";"0";"1";"Bekanntenkreis";"2";"2";"0";;"0";;"0";;"0";;"0";;"0";;"0";;"0";;"1";;"0";;"0";;"0";;"0";"0";"0";"0";"2";;"1";;;;;;;;;;;;;;;;;;;;;;;;;;;;;;;;;;;;;;;;;;;;;;;;;;;;;;;;;;;;;;;;;;;;;;;;;;;;;;;;;;;;;;;;;;;;;;;;;;;;;;;;;;;;;;;;;;;;;;;;;;;;;;;;;;;;;;;;;;;;;;;;"1";"1964";"Bayern";"Ansbach";"91522";;"Mozilla/5.0 (Windows NT 10.0; Win64; x64; rv:74.0) Gecko/20100101 Firefox/74.0";;"0";"0";;"0";"5472655,5460247,5460248,5460249,5460250,5460263,5460264,5460265,5460266,5460267,5460268,5460269,5460270,5460271,5460272,5460273,5460292,5460306,5460307,5460308,5460309,5460310,5460311,5460312";"1";"0";"0";;;"3b7ce39b3ce0db2248859dde8ec3f8f3";"1";"0";"1588275743";"2020-04-30 19:42:23";"2020-04-30 19:52:19";"0000-00-00 00:00:00";"49";"125";"152";"0";"0";"0";"0";"0";"0";"0";"0";"0";"0";"0";"0";"288";"321";"378";"397";"449";"457";"484";"492";"514";"0";"0";"0";"0";"0";"0";"0";"0";"0";"0";"0";"0";"0";"0";"0";"0";"0";"0";"0";"0";"0";"0";"0";"0";"0";"0";"0";"0";"0";"0";"0";"523";"535";"551";"572";"590";"596";"6"
