"lfdn";"external_lfdn";"tester";"dispcode";"lastpage";"quality";"duration";"v_606";"v_537";"v_538";"v_199";"v_200";"v_201";"v_202";"v_203";"v_204";"v_205";"v_206";"v_207";"v_210";"v_211";"v_212";"v_213";"v_214";"v_215";"v_217";"v_219";"v_220";"v_221";"v_224";"v_603";"v_604";"v_226";"v_227";"v_228";"v_229";"v_232";"v_233";"v_234";"v_235";"v_236";"v_237";"v_238";"v_240";"v_514";"v_241";"v_242";"v_243";"v_244";"v_245";"v_246";"v_247";"v_248";"v_249";"v_250";"v_251";"v_252";"v_253";"v_254";"v_255";"v_256";"v_257";"v_258";"v_259";"v_260";"v_261";"v_262";"v_263";"v_264";"v_265";"v_266";"v_267";"v_268";"v_269";"v_270";"v_271";"v_272";"v_273";"v_274";"v_280";"v_281";"v_282";"v_283";"v_284";"v_285";"v_286";"v_287";"v_288";"v_289";"v_290";"v_291";"v_292";"v_293";"v_294";"v_295";"v_296";"v_297";"v_434";"v_435";"v_298";"v_299";"v_587";"v_588";"v_300";"v_301";"v_302";"v_303";"v_305";"v_311";"v_313";"v_515";"v_516";"v_314";"v_315";"v_316";"v_317";"v_544";"v_545";"v_546";"v_547";"v_548";"v_549";"v_550";"v_551";"v_552";"v_553";"v_554";"v_555";"v_556";"v_557";"v_558";"v_559";"v_560";"v_561";"v_562";"v_563";"v_564";"v_565";"v_566";"v_567";"v_568";"v_569";"v_342";"v_343";"v_344";"v_345";"v_346";"v_347";"v_348";"v_349";"v_350";"v_351";"v_352";"v_353";"v_354";"v_355";"v_356";"v_357";"v_358";"v_359";"v_360";"v_361";"v_362";"v_363";"v_364";"v_365";"v_366";"v_367";"v_368";"v_369";"v_370";"v_371";"v_372";"v_373";"v_374";"v_375";"v_376";"v_377";"v_378";"v_379";"v_380";"v_381";"v_383";"v_437";"v_438";"v_510";"v_385";"v_518";"v_392";"v_393";"v_394";"v_395";"v_396";"v_397";"v_398";"v_399";"v_401";"v_570";"v_521";"v_522";"v_523";"v_524";"v_525";"v_526";"v_527";"v_528";"v_529";"v_530";"v_531";"v_532";"v_533";"v_404";"v_581";"v_582";"v_583";"v_584";"v_585";"v_586";"v_405";"v_406";"v_407";"v_508";"v_509";"v_408";"v_409";"v_410";"v_411";"v_412";"v_413";"v_414";"v_415";"v_416";"v_417";"v_418";"v_419";"v_420";"v_421";"v_422";"v_423";"v_424";"v_425";"v_504";"v_505";"v_506";"v_507";"v_593";"v_594";"v_428";"v_429";"v_431";"v_605";"v_432";"v_511";"v_387";"v_388";"v_433";"v_389";"v_390";"v_391";"browser";"referer";"device_type";"quota";"quota_assignment";"quota_rejected_id";"page_history";"hflip";"vflip";"output_mode";"javascript";"flash";"session_id";"language";"cleaned";"ats";"datetime";"date_of_last_access";"date_of_first_mail";"rts5460247";"rts5460248";"rts5460249";"rts5460251";"rts5460252";"rts5460253";"rts5460254";"rts5460255";"rts5460256";"rts5460257";"rts5460258";"rts5460259";"rts5460260";"rts5460261";"rts5460262";"rts5460264";"rts5460265";"rts5460266";"rts5460267";"rts5460268";"rts5460269";"rts5460270";"rts5460271";"rts5460272";"rts5460274";"rts5460275";"rts5460276";"rts5460277";"rts5460278";"rts5460279";"rts5460280";"rts5460281";"rts5460282";"rts5460283";"rts5460284";"rts5460285";"rts5460286";"rts5460287";"rts5460288";"rts5460289";"rts5460290";"rts5460291";"rts5460293";"rts5460294";"rts5460295";"rts5460296";"rts5460297";"rts5460298";"rts5460299";"rts5460300";"rts5460301";"rts5460302";"rts5460303";"rts5460304";"rts5460305";"rts5460306";"rts5460307";"rts5460308";"rts5460309";"rts5460310";"rts5460311";"rts5472655"
"1";"0";"0";"31";"5460312";;"468";;"1";"1";"0";"0";"0";"0";"0";"0";"0";"0";"0";"0";;"1";"1";"1";"1";"Testlauf";"0";"0";"0";"0";"0";;"Testlauf";"0";"0";"0";"0";"0";"0";"0";"0";"0";"Testlauf";"0";;;"0";"0";"0";"0";"0";"0";"0";"0";"0";"0";"0";"0";"0";"0";"0";"0";"0";"0";"0";"Testlauf";"6";;;"0";"0";"0";"0";"0";"0";"0";;"0";"0";"0";;"0";;"0";;"0";;"0";;"0";;"0";;"0";;"0";;"0";;"0";;"0";;"0";"0";"0";"0";"0";"Testlauf";"0";"0";"0";"Testlauf";"0";"0";"0";"0";;"0";;"0";;"0";;"0";;"0";;"0";;"0";;"0";;"0";;"0";;"0";;"0";;;;"0";;;"0";"0";"0";"0";"0";"0";;;"0";"0";"0";"0";"0";"0";;;;"0";"0";"0";"0";"0";"0";"0";"0";"0";"0";"0";"0";"0";"0";"0";"0";"0";"0";"0";;;;"0";;"TEstlauf";"0";"0";"0";"0";"0";"0";"0";"0";"0";"0";"0";"0";"0";"0";"0";"0";"0";"0";"0";"0";"0";;"TEstlauf";"0";;"0";;"0";;"TEstlauf";"0";;"0";;"0";;"0";;"0";;"0";;"0";;"0";;"0";;"0";;"0";;"0";;"0";;"0";;"TEstlauf";;"0";;"0";"TEstlauf";"0";;;;;"TEstlauf";"Mozilla/5.0 (Macintosh; Intel Mac OS X 10_14_6) AppleWebKit/605.1.15 (KHTML, like Gecko) Version/13.1 Safari/605.1.15";;"0";"0";;"0";"5460247,5460248,5460249,5460250,5460251,5460251,5460251,5460252,5460253,5460254,5460255,5460256,5460257,5460258,5460259,5460260,5460261,5460262,5460263,5460264,5460265,5460266,5460267,5460268,5460269,5460270,5460271,5460272,5460273,5460274,5460275,5460276,5460277,5460278,5460279,5460280,5460281,5460282,5460283,5460284,5460285,5460286,5460287,5460288,5460289,5460290,5460291,5460292,5460293,5460293,5460293,5460294,5460295,5460296,5460297,5460298,5460299,5460300,5460301,5460302,5460303,5460304,5460305,5460306,5460307,5460308,5460309,5460310,5460311,5460312";"0";"1";"0";;;"227f0750d71be2357562072cc806f089";"1";"0";"1586969462";"2020-04-15 16:51:02";"2020-04-15 16:58:50";"0000-00-00 00:00:00";"24";"42";"52";"70";"87";"92";"95";"98";"111";"118";"120";"124";"128";"132";"138";"143";"158";"164";"168";"213";"220";"223";"226";"240";"244";"303";"309";"315";"319";"321";"325";"327";"331";"335";"338";"341";"343";"346";"348";"350";"353";"356";"379";"383";"387";"390";"393";"403";"407";"416";"423";"429";"435";"437";"446";"450";"452";"454";"456";"461";"468";"0"
"2";"0";"0";"31";"5460312";;"1281";;"1";"1";"0";"0";"0";"0";"0";"0";"0";"0";"0";"0";;"1";"1";"1";"1";"Test";"0";"0";"0";"0";"0";;"Test";"0";"0";"0";"0";"0";"0";"0";"0";"0";"Test";"0";;;"0";"0";"0";"0";"0";"0";"0";"0";"0";"0";"0";"0";"0";"0";"0";"0";"0";"0";"0";"Test";"0";;;"0";"0";"0";"0";"0";"0";"0";;"0";"0";"0";;"0";;"0";;"0";;"0";;"0";;"0";;"0";;"0";;"0";;"0";;"0";;"0";"0";"0";"0";"0";"Test";"0";"0";"0";"Test";"0";"0";"0";"0";;"0";;"0";;"0";;"0";;"0";;"0";;"0";;"0";;"0";;"0";;"0";;"0";;;;"0";;;"0";"0";"0";"0";"0";"0";;;"0";"0";"0";"0";"0";"0";;"Test";;"0";"0";"0";"0";"0";"0";"0";"0";"0";"0";"0";"0";"0";"0";"0";"0";"0";"0";"0";;;;"0";;"test";"0";"0";"0";"0";"0";"0";"0";"0";"0";"0";"0";"0";"0";"0";"0";"0";"0";"0";"0";"0";"0";;"test";"0";;"0";;"0";;"test";"0";;"0";;"0";;"0";;"0";;"0";;"0";;"0";;"0";;"0";;"0";;"0";;"0";;"0";;"test";;"0";;"0";;"0";;;;;;"Mozilla/5.0 (Macintosh; Intel Mac OS X 10_14_6) AppleWebKit/537.36 (KHTML, like Gecko) Chrome/80.0.3987.149 Safari/537.36";;"0";"0";;"0";"5460247,5460248,5460249,5460250,5460251,5460252,5460253,5460254,5460255,5460256,5460257,5460258,5460259,5460260,5460261,5460262,5460263,5460264,5460265,5460266,5460267,5460268,5460269,5460270,5460271,5460272,5460273,5460274,5460275,5460276,5460277,5460278,5460279,5460280,5460281,5460282,5460283,5460284,5460285,5460286,5460287,5460288,5460289,5460290,5460291,5460292,5460293,5460293,5460293,5460294,5460295,5460296,5460297,5460298,5460299,5460300,5460301,5460302,5460303,5460304,5460304,5460305,5460306,5460307,5460308,5460309,5460310,5460311,5460312";"1";"0";"0";;;"4217d17ebc4716df1249324c80088a6e";"4";"0";"1586970990";"2020-04-15 17:16:30";"2020-04-15 17:37:51";"0000-00-00 00:00:00";"18";"25";"31";"41";"45";"60";"63";"67";"73";"80";"82";"85";"88";"92";"96";"101";"105";"111";"118";"124";"129";"133";"138";"145";"148";"152";"156";"160";"164";"166";"168";"171";"175";"179";"182";"186";"190";"199";"989";"994";"1000";"1005";"1018";"1023";"1026";"1028";"1032";"1036";"1041";"1047";"1053";"1056";"1068";"1150";"1233";"1263";"1267";"1270";"1275";"1277";"1281";"0"
"3";"0";"0";"32";"5460312";;"-1";"1";"1";"1";"1";"1";"1";"0";"1";"1";"1";"1";"1";"1";"Seriöses Gesamtbild";"0";"0";"1";"1";;;;;;;;;;;;;;;;;;;;;;;;;;;;;;;;;;;;;;;;;;;;;;;;;;;;;;;;;;;;;;;;;;;;;;;;;;;;;;;;;;;;;;"1";"1";"- direkte Bahnanbindung  - mexikanisches Essen!!!  - aufkeinenfall vegan/vegetarisch";"1";"1";"1";"1";"der Geruch kurz nachm Regen";"1";"Sternschnuppen sehen";"1";"Nachts um die Häuser ziehen";"1";"Rechtsfälle aufklären";"1";"Alte Erinnerungen/Erlebnisse";"0";;"0";;"1";"Klassik";"0";;"0";;"0";;"1";"Maximal";"0";;"4";"300";"7";;"1000";"0";"0";"0";"0";"1";"7";;"Entweder ganz oder gar nicht";"1";"0";"0";"0";"0";"0";;;"5";"1";"0";"1";"0";"0";"0";"0";"0";"0";"0";"0";"0";"0";"0";"0";"0";"0";"3";"7";;"Es den ökologischen Fußabdruck reduziert";;"7";;"- möglichst viel Kontakt mit Menschen    ";"1";"0";"0";"0";"0";"0";"0";"1";"6";"0";"0";"0";"0";"0";"0";"0";"0";"0";"0";"1";"0";;;"1";"Abfallwirtschaftswesen";"1";"BWL";"0";;;"0";;"0";;"0";;"0";;"0";;"0";;"0";;"0";;"0";;"0";;"0";;"0";;"0";;"0";;"- Talentiert, Umfragen auszufüllen";;"1";;"3";;"4";"1999";"Österreich";"Wien";;"Eine wirklich sehr gelungene Umfrage!";"Mozilla/5.0 (Linux; Android 9; SAMSUNG SM-A750FN) AppleWebKit/537.36 (KHTML, like Gecko) SamsungBrowser/11.1 Chrome/75.0.3770.143 Mobile Safari/537.36";;"0";"0";;"0";"5472655,5460247,5460248,5460249,5460250,5460263,5460273,5460274,5460275,5460276,5460277,5460278,5460279,5460280,5460281,5460282,5460283,5460284,5460285,5460286,5460287,5460288,5460289,5460290,5460291,5460292,5460293,5460294,5460295,5460296,5460297,5460297,5460298,5460299,5460300,5460301,5460302,5460303,5460304,5460305,5460306,5460307,5460308,5460309,5460310,5460311,5460312";"1";"0";"0";;;"ba44933a5da5b4d2dced535f0f40dce1";"1";"0";"1587226191";"2020-04-18 16:09:51";"2020-04-18 17:39:20";"0000-00-00 00:00:00";"26";"197";"216";"0";"0";"0";"0";"0";"0";"0";"0";"0";"0";"0";"0";"0";"0";"0";"0";"0";"0";"0";"0";"0";"225";"399";"407";"4751";"4758";"4787";"4794";"4823";"4834";"4859";"4866";"4885";"4896";"4923";"4929";"4962";"4972";"4978";"5018";"5023";"5030";"5048";"5076";"5153";"5160";"5169";"5185";"5248";"5280";"5284";"5295";"5301";"5311";"5319";"5329";"5346";"5369";"5"
"4";"0";"0";"31";"5460312";;"1125";"1";"1";"1";"1";"1";"1";"0";"0";"0";"1";"1";"0";"0";;"0";"0";"1";"1";;;;;;;;;;;;;;;;;;;;;;;;;;;;;;;;;;;;;;;;;;;;;;;;;;;;;;;;;;;;;;;;;;;;;;;;;;;;;;;;;;;;;;"0";"1";"Wlan- und Funk-frei; Duftfrei";"1";"0";"0";"1";;"0";;"1";;"1";;"0";;"1";;"1";;"0";;"0";;"1";"Kurz gesagt: ich bin Funkflüchtling. Der Funk hat mein Leben zerstört , als ich 32 Jahre alt war und ich war obdachlos wegen des Funks";"0";;"0";;"0";;"1";"0";"6";"Leider gar keine. Ich bekomme nichts vom Staat und werde verarmt....";"0";"1";"0";"0";"0";"0";"6";"ich würde gerne mein Alarmgerät für die Strahlung in der Wohnung für mindestens eine Woche anschließen, um zu sehen ob die Nachbarn funken";;"0";"0";"0";"0";"0";"1";"Immscout (seit einem Jahr, komplett verzweifelt schon und ohne Erfolg)";"Niederige Strahlenwerte, maximal 1 mikrowatt pro qm.!!! saubere Luft (keine Fabriken usw.)  Kein Schimmel, keine funkenden Besucher bei den Nachbarn  Zentralheizung wäre schön. Alles andere ist egal. Wie es ist menschlich zu leben, habe ich vor etwa zwei Jahren schon vergessen.";"0";"0";"0";"0";"0";"0";"1";"0";"0";"0";"0";"0";"0";"0";"0";"0";"0";"0";"1";"7";;"wenn sie funkfrei wären dann ja. Momentan kann ich sie gar nicht benutzen. Ich wohne in Leipzig und kenne die Stadt gar nicht. Bin eingefangen in einem etwa 3 qm Käfig";"weiß ich nicht....";"8";"nicht offiziell, weil ich EHS bin, aber ich war und werde auch manchmal zum Pflegefall";"Funkfrei, Saubere Luft, intilligente Kollegen";"0";"0";"0";"1";"1";"0";"0";"4";"4";"0";"0";"0";"0";"0";"0";"0";"1";"0";"0";"0";"0";;"Sprachen, Übersetzung, Musik, Adminstration";"1";"Bachelor in Musik (jetzt studiere ich DaF)";"0";;"0";;"Als Deutschlehrerin und Übersetzerin";"7";"Ich bin an EHS erkrankt und muss kündigen";"0";;"0";;"0";;"0";;"0";;"0";;"0";;"0";;"0";;"0";;"0";;"0";;"0";;"Viel zu lernen.....";;"1";;"4";;"2";"1986";"Deutschland";"Leipzig";"04178";"Ich (und weitere Millionen Deutsche) würde mich über eine Wohnung, die mich nicht quält, sehr freuen. Danke Ihnen. Bitte erstellen Sie das geplante Portal";"Mozilla/5.0 (Windows NT 6.1) AppleWebKit/537.36 (KHTML, like Gecko) Chrome/80.0.3987.163 Safari/537.36";;"0";"0";;"0";"5472655,5460247,5460248,5460249,5460250,5460263,5460273,5460274,5460275,5460276,5460277,5460278,5460279,5460280,5460281,5460282,5460283,5460284,5460285,5460286,5460287,5460288,5460289,5460290,5460291,5460292,5460293,5460294,5460295,5460296,5460297,5460298,5460299,5460300,5460301,5460302,5460303,5460304,5460305,5460306,5460307,5460308,5460309,5460310,5460311,5460312";"0";"0";"0";;;"bd763ae95d0e8f0daf5a8a8ba8a65dc6";"1";"0";"1587229212";"2020-04-18 17:00:12";"2020-04-18 17:18:57";"0000-00-00 00:00:00";"24";"63";"79";"0";"0";"0";"0";"0";"0";"0";"0";"0";"0";"0";"0";"0";"0";"0";"0";"0";"0";"0";"0";"0";"85";"99";"107";"208";"220";"227";"260";"270";"277";"344";"381";"501";"550";"579";"585";"636";"688";"722";"758";"774";"785";"791";"799";"868";"884";"909";"923";"962";"971";"978";"984";"989";"996";"1003";"1013";"1020";"1125";"5"
"7";"0";"0";"31";"5460312";;"1700";"1";"1";"1";"1";"1";"1";"1";"1";"1";"1";"0";"1";"0";;"0";"0";"1";"1";;;;;;;;;;;;;;;;;;;;;;;;;;;;;;;;;;;;;;;;;;;;;;;;;;;;;;;;;;;;;;;;;;;;;;;;;;;;;;;;;;;;;;"0";"1";"WLAN und DECT-Frei, ruhig (Abends/ nachts). Ich bin seit 10 Jahren Elektrosensibel- daher wäre passender Wohnraum super, es suchen sehr viele danach.";"1";"0";"0";"0";;"0";;"0";;"0";;"0";;"0";;"0";;"0";;"0";;"0";;"0";;"0";;"1";"Nichts von allem. Bin aber sehr hilfsbereiter Mensch und im Bereich PC/ Büro super fit. Kann unterstützend helfen";"1";"800";"6";"Seit 2 Jahren aufgrund Gesundheit. Davor habe ich 8 Jahre Vollzeit im Büro gearbeitet. ";"0";"1";"0";"0";"0";"0";"6";"Bei Umwelt-Sensibilitäten ist eine Probewohnen enorm wichtig. Eine Wohnungsbesichtigung reicht in keinem Fall aus, da die Beschwerden oft etwas Zeitverzögert auftreten. Dadurch habe ich 3 Wohnungen wieder kündigen müssen";;"0";"0";"0";"0";"1";"0";;"Miete (warm), Ort, Helligkeit, Gepflegt. Anschluss an den öffentlichen Nahverkehr. Sehr wichtig: das einschätzen, ob die Wohnung Funkarm sein könnte- was aber erst bei der Besichtigung prüfbar ist. ";"400";"0";"0";"0";"0";"1";"1";"1";"0";"0";"0";"0";"0";"0";"0";"0";"0";"0";"1";"7";;"Da ich kein Fahrzeug besitze und für eine evtl. Arbeitsstelle tägl. Abfahrt";"Ich suche seit 10 Jahren Wohnraum ohne WLAN-Belastung. Ich möchte gerne ''ankommen'' und mich endlich niederlassen. Entspannen und ein echtes Zuhause haben. Mein Umfeld wäre natürlich sehr glücklich. ";"6";;"Mit öffentlichen Verkehrsmitteln erreichbar. Soziale Arbeitsmöglichkeit- statt mit ''Ellenbogen''. Wahl zwischen Vollzeit/ Teilzeit etc. Arbeitsplatz nach Möglichkeit mit wenig Funkbelastung";"0";"0";"0";"0";"0";"1";"0";"3";"2";"0";"0";"0";"0";"0";"0";"0";"1";"0";"0";"0";"0";;"Bäckereifachverkäuferin | Büro  ";"1";"Fachverkäuferin im Nahrungsmittelhandwerk- Schwerpunkt Bäckerei Konditorei";"0";;"0";;"Büro oder anderweitig als Quereinsteiger, lerne schnell";"6";;"0";;"0";;"0";;"0";;"0";;"0";;"0";;"0";;"0";;"0";;"0";;"0";;"0";;"Keine, bin in sämtlichen Bereichen etwas talentiert. Multifunktionell einsetzbar ;)";"Ich sehe mich als normalen Arbeitnehmer. Ich arbeite ruhig, eigenständig, bin entspannt, nett, lerne rasch";"1";;"4";"Kein IQ Test getätigt. Denke aber, ist vollkommen normaler Durchschnitts-IQ.";"2";"1980";"Deutschland";"Hamburg";"25469";"Ich wünsche mir Angebote für Wohnraum ohne WLAN (Sehr schwacher Empfang ist tolerabel). Und bezahlbar. Warm als Single-Frau 330-390 €. Größe ab 27qm. ";"Mozilla/5.0 (Windows NT 6.1; Win64; x64) AppleWebKit/537.36 (KHTML, like Gecko) Chrome/81.0.4044.113 Safari/537.36";;"0";"0";;"0";"5472655,5460247,5460248,5460249,5460250,5460263,5460273,5460274,5460275,5460276,5460277,5460278,5460279,5460280,5460281,5460282,5460283,5460284,5460285,5460286,5460287,5460288,5460289,5460290,5460291,5460292,5460293,5460294,5460295,5460296,5460297,5460298,5460299,5460300,5460301,5460302,5460303,5460304,5460305,5460306,5460307,5460308,5460309,5460310,5460311,5460312";"1";"1";"0";;;"dba5a530dc97adc9999dc93355d3696b";"1";"0";"1587232030";"2020-04-18 17:47:10";"2020-04-18 18:15:30";"0000-00-00 00:00:00";"21";"154";"172";"0";"0";"0";"0";"0";"0";"0";"0";"0";"0";"0";"0";"0";"0";"0";"0";"0";"0";"0";"0";"0";"177";"263";"269";"421";"431";"440";"472";"481";"490";"604";"616";"715";"782";"816";"821";"858";"937";"941";"1036";"1043";"1047";"1052";"1059";"1180";"1212";"1225";"1240";"1291";"1438";"1442";"1503";"1507";"1512";"1519";"1528";"1549";"1700";"3"
"8";"0";"0";"31";"5460312";;"3000";"1";"1";"2";"0";"1";"0";"1";"0";"0";"1";"0";"0";"1";;"0";"0";"1";"0";;;;;;;;;;;;;;;;;;;;;;;;;;;;;;;;;;;;;;;;;;;;;;;;;;;;;;;;;;;;;;;;;;;;;;;;;;;;;;;;;;;;;;"0";"1";"rauchfrei, duftfrei, wlan- und funkfrei, kein Fahrstuhl, Ruhe  seperate Räume: Küche, Wohnstube, Schlafzimmer welche man einzeln vom Stromnetz trennen kann  Bad mit Fenster und Badewanne (zum entgiften)  Flur als Schleuse nutzbar, um keine Allergene in die Wohnung zu schleppen (z.Bsp. bei Pollenallergiker, MCS-Erkrankte welche auf Tabakrauch und andere Duftstoffe reagieren)  öffentliche Verkehrsmittel in der Nähe, Einkaufsmöglichkeiten und welche Ärzte in der Nähe erreichbar sind";"1";"0";"0";"1";"duftstoff- und tabakrauchfreies Haus, da Gerüche wie Weichspüler, Parfüm, Tabakrauch warm + kalt zum Kreislaufkollaps führen können... bis zu 3h bewußtlos";"0";;"1";"da die Wohnung sowas wie ein Rückzugsort von äußeren Einflüssen sein soll, wäre ein rauchfreier Balkon, oder Terrasse herrlich oder eine ruhige Gartenecke";"0";;"1";"Kurzzeitgedächtnis leider nicht ganz in Ordnung, aber gegenüber 2007 durch Training wieder besser";"1";"wenn wlan- und rauch- und funkfrei sollte das in Ordnung sein";"0";;"1";"super";"1";"super";"1";"kaum, da MCS";"0";;"0";;"0";;"1";"750";"6";"Rente + aufstockende Grundsicherung... in Höhe der Grundsicherung";"0";"1";"1";"0";"0";"0";"6";"weil man Besichtigungen meist tagsüber hat, wenn angrenzende Bewohner nicht zu Hause sind, nicht mitbekommt, ob Tabakrauch in den Wänden sitzt o. i. die Wohnung zieht, o. WLAN-Verstärker o. verbaute Smartmeter Dauerfunker sind (z.B. Techem)";;"1";"1";"0";"0";"1";"1";"spezielle Gruppen zu den entsprechenden Erkrankungen";"Absolute Schimmelfreiheit; Nichtraucherhaus, auch ohne rauchende Besucher auf dem Gelände; damit auch das Treppenhaus nicht nach kaltem Rauch stinkt;  Informationen über die Baumaterialien bei mir nur bedingt, da Tabakrauch eh alles durchdringt";"500";"0";"0";"0";"0";"0";"0";"0";"1";"1";"1";"0";"0";"0";"0";"0";"0";"0";"1";"7";;"aus gesundheitlichen Gründen nicht in der Lage Auto zu fahren, da nach Kontaminierung mit Tabakrauch nur 3sek für rechts ran und anhalten";"Gesundheit";"6";;;;;;;;;;;;;;;;;;;;;;;;;;;;;;;;;;;;;;;;;;;;;;;;;;;;;;;;;;;;;;;;;;;"2";"1964";"D";"Rostock";"18";"Den Punkt Nichtraucherwohnung, Nichtraucherhaus sucht man bisher vergebens, obwohl es bereits Häuser mit nur Nichtrauchern gibt.... und es laut Vermieterforum, auch Vermieter gibt die nur Nichtraucher akzeptieren, nicht wg. Diskriminierung, sondern wg der 250 giftigen + 2 radioaktiven Stoffe /Zigarette  welche sich in den Wänden ablegen und in die Nachbarwohnung dringen. + so die Wohnung für einen nachfolgenden NR-Mieter unmöglich machen.";"Mozilla/5.0 (Windows NT 10.0; Win64; x64; rv:75.0) Gecko/20100101 Firefox/75.0";;"0";"0";;"0";"5472655,5460247,5460248,5460249,5460250,5460263,5460273,5460274,5460275,5460276,5460277,5460278,5460279,5460280,5460281,5460282,5460283,5460284,5460285,5460286,5460287,5460288,5460289,5460290,5460291,5460292,5460306,5460307,5460308,5460309,5460310,5460311,5460312";"1";"0";"0";;;"73f110015e09ef2db916a70e00092a18";"1";"0";"1587238012";"2020-04-18 19:26:52";"2020-04-18 20:16:52";"0000-00-00 00:00:00";"33";"95";"123";"0";"0";"0";"0";"0";"0";"0";"0";"0";"0";"0";"0";"0";"0";"0";"0";"0";"0";"0";"0";"0";"129";"692";"703";"1219";"1234";"1262";"1330";"1353";"1382";"1763";"1856";"2069";"2165";"2259";"2270";"2423";"2501";"2513";"0";"0";"0";"0";"0";"0";"0";"0";"0";"0";"0";"0";"0";"2520";"2530";"2537";"2557";"2573";"3000";"5"
"9";"0";"0";"31";"5460312";;"911";"1";"1";"1";"0";"1";"1";"1";"1";"1";"1";"1";"0";"0";;"0";"0";"1";"1";;;;;;;;;;;;;;;;;;;;;;;;;;;;;;;;;;;;;;;;;;;;;;;;;;;;;;;;;;;;;;;;;;;;;;;;;;;;;;;;;;;;;;"0";"1";"Wlan und funkfrei";"1";"0";"0";"0";;"1";"Natur";"0";;"0";;"0";;"0";;"0";;"0";;"0";;"0";;"0";;"0";;"0";;"1";"900";"7";;;"1";"1";"0";"0";"0";"7";;;"0";"1";"0";"1";"0";"0";;"Naturnähe; Garten; funkfrei; ähnlich Gesinnte Mitmieter";"1000";"0";"0";"0";"0";"0";"1";"1";"1";"0";"0";"0";"0";"0";"0";"1";"1";"1";"1";"5";"ich dann einen Pkw haben werde";;;"6";;"ein kleines nachhaltiges regionales Unternehmen mit sozialen Werten und flacher Hierarchie";"0";"0";"0";"0";"0";"0";"0";"4";"3";"0";"0";"1";"0";"1";"0";"0";"0";"0";"0";"0";"0";;"Bildungswesen; Freizeitbereich; Kultur";"1";"Tanzpädagogin";"0";;"0";;"Kursleiterin, Allrounder";"7";"vertrage keinen Funk";"0";;"0";;"1";"nicht den ganzen Tag sitzen";"0";;"0";;"0";;"0";;"0";;"0";;"0";;"0";;"0";;"1";"kein Funk";"Zusammenhänge und Hintergründe schnell begreifen, Gruppen anleiten, kreative Prozesse anleiten, Menschen zu sich selbst führen, in die Entspannung, in Bewegung bringen, innerlich wie äußerlich";;"1";;"4";;"2";"1968";"Deutschland";"Oranienburg";"16515";"Viel Erfolg! Es braucht viele solcher Plattformen, Angebote usw. Liebe Grüße";"Mozilla/5.0 (Windows NT 10.0; Win64; x64) AppleWebKit/537.36 (KHTML, like Gecko) Chrome/81.0.4044.113 Safari/537.36";;"0";"0";;"0";"5472655,5460247,5460248,5460249,5460250,5460263,5460273,5460274,5460275,5460276,5460277,5460278,5460279,5460280,5460281,5460282,5460283,5460284,5460285,5460286,5460287,5460288,5460289,5460290,5460291,5460292,5460293,5460294,5460295,5460296,5460297,5460298,5460299,5460300,5460301,5460302,5460303,5460304,5460305,5460306,5460307,5460308,5460309,5460310,5460311,5460312";"1";"1";"0";;;"b543138798bf3411698bef6adfbe5243";"1";"0";"1587239680";"2020-04-18 19:54:40";"2020-04-18 20:09:51";"0000-00-00 00:00:00";"22";"75";"87";"0";"0";"0";"0";"0";"0";"0";"0";"0";"0";"0";"0";"0";"0";"0";"0";"0";"0";"0";"0";"0";"96";"142";"152";"224";"230";"239";"247";"252";"265";"274";"286";"355";"375";"409";"417";"444";"454";"459";"517";"529";"535";"543";"556";"627";"648";"667";"701";"798";"808";"812";"819";"824";"830";"840";"847";"855";"911";"4"
